ilmassa 20 °c 1,013 bar fraunhoferin viiva aallonpituus nm 760,8 686,7 656,3 589,3 527,0 486,1 430,8 396,8 alkuperä \text{H}_{\alpha} na fe \text{H}_{\beta} fe ca väri punainen punainen oranssi keltainen vihreä sininen sininen violetti akryyli 1,503 1,491 1,507 1,489 1,494 1,497 bentseeni 1,491 1,494 1,496 1,501 1,508 1,513 1,520 1,534 dietyylieetteri 1,349 1,350 1,351 1,353 1,355 1,357 1,361 1,364 etanoli 1,358 1,359 1,360 1,362 1,364 1,366 1,371 1,374 glyseroli 1,465 1,466 1,467 1,469 1,472 1,475 1,480 1,484 hiilisulfidi 1,609 1,615 1,618 1,628 1,641 1,652 1,677 1,699 jää 0 °c ys 1,309 jää 0 °c) es 1,311 kalsiumfluoridi 1,431 1,432 1,433 1,434 1,435 1,437 1,440 1,442 kalsiumkarbonaatti ys 1,650 1,653 1,654 1,658 1,664 1,668 1,676 1,683 kalsiumkarbonaatti es 1,483 1,484 1,485 1,486 1,489 1,491 1,494 1,498 kruunulasi 1,505 1,507 1,508 1,510 1,514 1,516 1,522 1,525 natriumkloridi 1,537 1,540 1,541 1,544 1,549 1,553 1,561 1,568 piidioksidi ys 1,539 1,541 1,542 1,544 1,547 1,550 1,554 1,558 piidioksidi es 1,548 1,550 1,551 1,553 1,556 1,559 1,563 1,568 piilasi 1,603 1,606 1,608 1,613 1,619 1,625 1,635 1,645 timantti 2,454 2,417 2,410 vesi 1,329 1,330 1,331 1,333 1,335 1,337 1,341 1,344 ys  on yleissääntöinen säde es  on erikoissääntöinen säde; 13754439226679; Aineiden taitekertoimia; body
indikaattori väri värin vaihtumis­alueen ph tymolisininen 1,2–2,88,2–9,8 metyylioranssi 3,1–4,4 bromikresolivihreä 3,8–5,4 metyylipunainen 4,4–6,0 bromitymolisininen 6,0–7,6 fenoliftaleiini 8,3–10,0 tymoliftaleiini 9,3–10,5 alitsariinikeltainen 10,0–12,0; 13754487720230; pH-indikaattoreita; body
intensiteettitaso  db kuulokynnys hengitys kellon tikitys kuiskaus lehtien havina 10–30 hiljainen puhe tai musiikki jääkaappi/pakastin 30–50 mikroaaltouuni 45–65 keskustelu 50–70 astianpesukone 50–75 kouluruokala pesukone 60–85 liikenne 70–85 pölynimuri 75–90 moottoripyöräkilpailut 85–90 trimmeri 70–95 pienlentokone moottoriruohonleikkuri 85–100 porakone 95–105 ukkonen kivipora moottorisaha 100–115 rockkonsertti yökerho 100–120 kipukynnys hälytyssireeni suihkumoottori 130–135 välitön kuulovaurio tykki tärykalvo repeytyy; 13754441826700; Äänen intensiteettitasoja; body
iso pieni kirjaimen nimi alfa beeta gamma delta epsilon zeeta eeta theeta ioota kappa lambda myy nyy ksii omikron pii rhoo sigma tau ypsilon fii khii psii oomega; 13730011989411; Kreikkalaiset aakkoset; body
jakauman muodostavat lukuparit x1, y1 x2, y2 … xn, yn muuttujien x ja y kovarianssi {{s}_{xy}}=\dfrac{\underset{i=1}{\overset{n}{\mathop{\Sigma }}}\,({{x}_{i}}-\bar{x})({{y}_{i}}-\bar{y})}{n} pearsonin korrelaatiokerroin tulomomenttikerroin \begin{align}  r &=\dfrac{\underset{i=1}{\overset{n}{\mathop{\Sigma }}}({{x}_{i}}-\bar{x})({{y}_{i}}-\bar{y})}{\sqrt{\underset{i=1}{\overset{n}{\mathop{\Sigma }}}{{({{x}_{i}}-\bar{x})}^{2}}\underset{i=1}{\overset{n}{\mathop{\Sigma }}}{{({{y}_{i}}-\bar{y})}^{2}}}} =\dfrac{n\Sigma xy-\Sigma x\Sigma y}{\sqrt{\left[ n\Sigma {{x}^{2}}-{{(\Sigma x)}^{2}} \right]{{\left[ n\Sigma {{y}^{2}}-{{(\Sigma y)}^{2}} \right]}}}}=\dfrac{{{s}_{xy}}}{{{s}_{x}}{{s}_{y}}} \end{align}  sx ja sy ovat muuttujien x ja y keskihajonnat kaavat ovat artikkelissa "todennäköisyyslaskenta ja tilastotiede tilastollisten jakaumien tunnuslukuja" spearmanin järjestyskorrelaatiokerroin {{r}_{s}}=1-\dfrac{6\underset{i=1}{\overset{n}{\mathop{\Sigma}}}{d}_{i}^{2}}{n({{n}^{2}}-1)} di = parin xi, yi järjestyslukujen erotus korrelaation tulkinta suoran sovitus pistejoukkoon Jos y riippuu tilastollisesti lineaarisesti x:stä ja on tehty esim. mittaussarja (xi, yi), on parhaiten riippuvuutta kuvaavan suoran eli regressiosuoran y = bx + a kulmakerroin b=\dfrac{n\Sigma {{x}_{i}}{{y}_{i}}-(\Sigma {{x}_{i}})(\Sigma {{y}_{i}})}{n\Sigma {{x}_{i}}^{2}-{{(\Sigma {{x}_{i}})}^{2}}} ja vakio a=\dfrac{\Sigma {{y}_{i}}-b\Sigma {{x}_{i}}}{n}. selitysaste on r2 korrelaatiokertoimen r arvot ovat välillä −1 ≤ r ≤ 1 jos r = ±1 niin x ja y riippuvat toisistaan lineaarisesti korrelaatiokertoimen tarkempi tulkinta riippuu havaintoparien lukumäärästä n mutta suuntaa antavasti voidaan todeta; 13730070855252; Kahden diskreetin muuttujan tilastollinen jakauma; body
jos jatkuva satunnaismuuttuja x noudattaa normaalijakaumaa parametrein μ ja σ niin merkitään x ∼ n(μ, σ  jos jakauma on normitettu niin x ∼ n(0, 1 Jos X ∼ N(μ, σ ), niin Z=\dfrac{X-\mu }{\sigma }\sim \text{N}(0,\ 1).; 15675905478952; Normaalijakauma; body
jos joukossa on n alkiota niistä voidaan muodostaa erilaisia; 13730070921314; Kombinatoriikka; body
jos kokonaislukukertoimisen yhtälön ax + by + c = 0 yksittäinen kokonaislukuratkaisu on x0, y0 niin kaikki kokonaislukuratkaisut ovat \left\{ \begin{align} & x={{x}_{0}}+n \cdot \dfrac{b}{\text{syt}(a,\ b)} \\ & y={{y}_{0}}-n \cdot \dfrac{a}{\text{syt}(a,\ b)} \\ \end{align} \right.\qquad (n\in \mathbb{Z}); 13730069889358; Diofantoksen yhtälö; body
jos vastuksessa on neljä viivaa pois jäävät lämpötilakerroin ja kolmas merkitsevä numero; 13754443885404; Vastusten värikoodit; body
kaasu kaava kiehumispiste °c liukoisuus veteen1 1,013 bar 0 °c 20 °c ammoniakki \text{NH}_3 1 300 702 happi \text{O}_2 0,049 0,031 hiilidioksidi \text{CO}_2 1,71 0,88 kloori \text{Cl}_2 4,61 2,30 rikkidioksidi \text{SO}_2 79,8 39,3 typpi \text{N}_2 0,024 0,015 vety \text{H}_2 0,021 0,018 vetykloridi hcl 506 442 vetysulfidi \text{H}_2 \text{S} 4,68 2,58 1) yhteen litraan vettä liukenevan kaasun tilavuus litroina normaalipaineessa; 13754466548374; Kaasujen ominaisuuksia; body
kaavoissa vakio a > 0 1. \displaystyle \lim_{n\to \infty}\sqrt[n]{n}=1 2. \displaystyle \lim_{n\to \infty}{{\left( 1+\dfrac{1}{n} \right)}^{n}}=\text{e}\approx 2,718\ 282 neperin luku 3. \displaystyle \lim_{n\to \infty}\left( 1+\dfrac{1}{2}+\dfrac{1}{3}+\ldots +\dfrac{1}{n}-\ln n \right)\approx 0,577\ 216 eulerin vakio 4. \displaystyle \lim_{n\to \infty}\dfrac{{{a}^{n}}}{n!}=0 5. \displaystyle \lim_{x\to 0+}({{x}^{a}}\cdot \log x)=0 6. \displaystyle \lim_{x\to \infty}\dfrac{\log x}{{{x}^{a}}}=0 7. \displaystyle \lim_{x\to \infty}\dfrac{{{x}^{a}}}{{{e}^{x}}}=0 8. \displaystyle \lim_{n\to \infty}\left(n \cdot  \sin \dfrac{x}{n} \right)=x 9. \displaystyle \lim_{x\to 0}\dfrac{\sin x}{x}=1; 13730055306665; Raja-arvoja; body
kaksirivinen \left| \begin{matrix} a & b \\ c & d \\ \end{matrix} \right|=ad-bc kolmirivinen \left| \begin{matrix} a & b & c \\ d & e & f \\ g & h & i \\ \end{matrix} \right|=a\left| \begin{matrix} e & f \\ h & i \\ \end{matrix} \right|-b\left| \begin{matrix} d & f \\ g & i \\ \end{matrix} \right|+c\left| \begin{matrix} d & e \\ g & h \\ \end{matrix} \right|; 13730049815931; Determinantti; body
kaksoismerkeistä ylemmät merkit vastaavat toisiaan samoin alemmat \sin (x\pm y)=\sin x\cos y\pm \cos x\sin y  \cos (x\pm y)=\cos x\cos y\mp \sin x\sin y   \tan (x\pm y)=\dfrac{\tan x\pm \tan y}{1\mp \tan x\tan y}  \sin x+\sin y=2\sin \dfrac{x+y}{2}\cos \dfrac{x-y}{2}  \sin x-\sin y=2\cos \dfrac{x+y}{2}\ \sin \dfrac{x-y}{2}  \cos x+\cos y=2\cos \dfrac{x+y}{2}\ \cos \dfrac{x-y}{2}  \cos x-\cos y=-\,2\sin \dfrac{x+y}{2}\ \sin \dfrac{x-y}{2}  \tan x\pm \tan y=\dfrac{\sin (x\pm y)}{\cos x\cos y}  \cos x\pm \sin x=\sqrt{2}\sin \left( \dfrac{\pi }{4}\pm x \right)=\sqrt{2}\cos \left( \dfrac{\pi }{4}\mp x \right); 13730059753078; Summakaavoja; body
kansainvälinen mittayksikköjärjestelmä on yksikköjärjestelmä jossa näiden määrittelevien vakioiden lukuarvot ovat tarkkoja cgpm 13.−16.11.2018 otettu käyttöön 20.5.2019; 15680972268180; SI-järjestelmän luonnonvakiot; body
kantaluku nimi merkit binaari 0 1 oktaali 0 1 2 3 4 5 6 7 10 desimaali 0 1 2 3 4 5 6 7 8 9 16 heksadesimaali 0 1 2 3 4 5 6 7 8 9 a b c d e f esimerkki \begin{align} & 1\text{BA}0_{16} \\ & =1\cdot 16^3+11\cdot 16^2+10\cdot 16^1+0\cdot 16^0 \\ & =7 \ 072_{10} \\ \end{align}; 13730069901899; Lukujärjestelmiä; body
kauppanimi koostumus chilensalpietari \text{NaNO}_3 kali)aluna \text{Al}_2\text{(SO}_4\text{)}_3 \cdot \text{K}_2 \text{SO}_4 \cdot 24 \ \text{H}_2\text{O} kalilipeä koh:n vesiliuos kalkkisalpietari \text{Ca(NO}_3\text{)}_2 karborundum sic katkerosuola \text{MgSO}_4 \cdot 7 \ \text{H}_2\text{O} kiinnityssuola \text{Na}_2 \text{S}_2 \text{O}_3 \cdot 5 \ \text{H}_2\text{O} kipsi \text{CaSO}_4 \cdot 2 \ \text{H}_2\text{O} kuningasvesi väkevän typpi- ja vetykloridihapon seos kuparivihtrilli \text{CuSO}_4 \cdot 5 \ \text{H}_2\text{O} lipeäkivi naoh lyijyvalkoinen 2 \ \text{PbCO}_3 \cdot  \text{Pb(OH)}_2 maantiesuola \text{CaCl}_2 magnesia alba 3 \ \text{MgCO}_3 \cdot  \text{Mg(OH)}_2 \cdot 3 \ \text{H}_2 \text{O} mönjä 2 \ \text{PbO} \cdot  \text{PbO}_2 eli \text{Pb}_3 \text{O}_4 natronlipeä naoh:n vesiliuos norjansalpietari \text{Ca(NO}_3 \text{)}_2 poltettu kalkki cao potaska \text{K}_2 \text{CO}_3 rautavihtrilli \text{FeSO}_4 \cdot 7 \ \text{H}_2 \text{O} rikkihiili \text{CS}_2 rikkivety \text{H}_2 \text{S} ruokasooda \text{NaHCO}_3 ruokasuola nacl ruskokivi ruunikivi \text{MnO}_2 salmiakki \text{NH}_4 \text{Cl} salpietari \text{KNO}_3 sammutettu kalkki \text{Ca(OH)}_2 suolahappo hcl-kaasun vesiliuos vesilasi \text{Na}_2 \text{O} \cdot n \ \text{SiO}_2, n = 3, 4, 5 koostumus vaihtelee koostumus vaihtelee epäpuhdas sammuttamaton kalkki cao sinkkivalkoinen zno sooda \text{Na}_2 \text{CO}_3 titaanivalkoinen \text{TiO}_2 booraksi \text{Na}_2 \text{B}_4 \text{O}_7 \cdot n \ \text{H}_2 \text{O}, n = 0, 5 tai 10; 13754466524514; Epäorgaanisten yhdisteiden kauppanimiä ja koostumuksia; body
keskeisdifferenssi {f}'(a)\approx \dfrac{f(a+h)-f(a-h)}{2h}; 13730069112094; Numeerinen derivointi; body
keskiarvo \bar{x}=\dfrac{\sum\limits_{i=1}^{n}{{{x}_{i}}}}{n} \bar{x}=\dfrac{\sum\limits_{i=1}^{k}{{{f}_{i}}{{x}_{i}}}}{\sum\limits_{i=1}^{k}{{{f}_{i}}}} keskihajonta {{s}_{n}}=\sqrt{\dfrac{\sum\limits_{i=1}^{n}{{{({{x}_{i}}-\bar{x})}^{2}}}}{n}} {{s}_{n}}=\sqrt{\dfrac{\sum\limits_{i=1}^{k}{{{f}_{i}}{{({{x}_{i}}-\bar{x})}^{2}}}}{n}} otoskeskihajonta {{s}_{n-1}}=\sqrt{\dfrac{\sum\limits_{i=1}^{n}{{{({{x}_{i}}-\bar{x})}^{2}}}}{n-1}} {{s}_{n-1}}=\sqrt{\dfrac{\sum\limits_{i=1}^{k}{{{f}_{i}}{{({{x}_{i}}-\bar{x})}^{2}}}}{n-1}} keskipoikkeama \text{M.D.}=\dfrac{\sum\limits_{i=1}^{n}{\left| {{x}_{i}}-\bar{x} \right|}}{n} \text{M.D.}=\dfrac{\sum\limits_{i=1}^{k}{{{f}_{i}}\left| {{x}_{i}}-\bar{x} \right|}}{n} luokitellussa aineistossa luvut on jaettu k luokkaan joiden frekvenssit ovat f1, f2 …, fk tyyppiarvo eli moodi mo on se jakauman luku tai luvut jolla on suurin frekvenssi luokitellun aineiston moodiluokka on luokka jolla on suurin frekvenssi mediaani md on suuruusjärjestykseen lajitellun jakauman keskimmäinen luku jos lukuja on parillinen määrä niin mediaani on kahden keskimmäisen luvun keskiarvo luokitellun aineiston mediaaniluokka on se luokka jonka summafrekvenssi ensimmäisenä saavuttaa 50 %:n rajan vaihteluväli δ on jakauman suurimman ja pienimmän luvun erotus varianssi on keskihajonnan neliö s2 Keskiarvon keskivirhe {{s}_{{\bar{x}}}}=\dfrac{s}{\sqrt{n}} havainnot {{x}_{1}},\ {{x}_{2}},\ \ldots ,\ {{x}_{n}} havaintojen lukumäärä n x_1\ (f_1\text{ kpl}),\ x_2\ (f_2\text{ kpl}),\ \ldots ,\ {{x}_{k}}\ (f_k\text{ kpl}) {{f}_{1}}+{{f}_{2}}+\cdots +{{f}_{k}}=n; 13730070829882; Tilastollisten jakaumien tunnuslukuja; body
kiinteät aineet ja nesteet 20 °c kaasut 0 °c 101 325 pa väliaine nopeusm/s metallit1 alumiini 5 080 beryllium 12 550 hopea 2 790 kulta 2 030 kupari 3 800 lyijy 1 200 magnesium 5 070 molybdeeni 6 250 nikkeli 4 900 platina 2 820 rauta teräs 5 100 sinkki 3 810 muut kiinteät aineet1 betoni 4 300 graniitti 4 000 jää –4 °c 3 280 korkki 500 kruunulasi 5 000 piilasi 4 000 posliini 4 880 puu 3 500 tiili 3 650 nesteet asetoni 1 190 bentseeni 1 326 elohopea 1 450 etanoli 1 168 glyseroli 1 900 vesi 0 °c 1 403 vesi 20 °c 1 484 vesi 40 °c 1 529 vesi 60 °c 1 540 vesi 80 °c 1 555 vesi 100 °c 1 543 kaasut ammoniakki 415 argon 319 bromi 135 happi 316 happi –183 °c 912 helium 965 hiilidioksidi 260 hiilimonoksidi 338 ilma –40 °c 307 ilma –20 °c 319 ilma 0 °c 331,4 ilma +20 °c 343 ilma +40 °c 354 ilma +60 °c 365 kevyt vety 1 284 kloori 206 metaani 430 neon 435 raskas vety 890 typpi 334 typpi –197 °c 869 vesihöyry 100 °c 405 vesihöyry 135 °c 495 1) pitkittäinen aaltoliike ohuessa tangossa; 13754441809618; Äänen nopeus väliaineessa; body
kolmio kulmien summa pinta-ala \ A=\frac{1}{2}ah_a=\frac{1}{2}ac\sin\beta=2R^2\sin\alpha\sin\beta\sin\gamma sisään piirretyn ympyrän säde r=\dfrac{2A}{a+b+c} ympäri piirretyn ympyrän säde R=\dfrac{abc}{4A}=\dfrac{bc}{2{{h}_{a}}}=\dfrac{a}{2\sin \alpha }=\dfrac{b}{2\sin \beta }=\dfrac{c}{2\sin \gamma } sinilause \dfrac{a}{\sin \alpha }=\dfrac{b}{\sin  \beta }=\dfrac{c}{\sin  \gamma }=2R kosinilause laajennettu pythagoraan lause {{a}^{2}}={{b}^{2}}+{{c}^{2}}-2bc\cos \alpha  kolmion ominaisuuksia samassa pisteessä leikkaavat viivat leikkauspiste keskijanat eli mediaanit painopistejakosuhde 1:2 kulmien puolittajat sisään piirretyn  ympyrän keskipiste\dfrac{a}{b}=\dfrac{x}{y} keskinormaalit ympäri piirretyn ympyrän keskipiste neliö A={{a}^{2}} d=a\sqrt{2} suorakulmio A=ab d=\sqrt{{{a}^{2}}+{{b}^{2}}} neljäkäs \begin{align} A&=ah=\dfrac{1}{2}{{d}_{1}}{{d}_{2}} \\ & ={{a}^{2}}\sin \alpha \end{align} suunnikas a = ah = ab sin β  puolisuunnikas A=\dfrac{1}{2}(a+b)h=mh nelikulmio A=\dfrac{1}{2}d_1 d_2\sin \varphi  säännölliset monikulmiot tasasivuinen kolmio neliö säännöllinen viisikulmio säännöllinen kuusikulmio monikulmion sivu a sisään piirretyn ympyrän  säde \dfrac{a\sqrt{3}}{6} \dfrac{a}{2} \dfrac{a}{10}\sqrt{25+10\sqrt{5}} \dfrac{a\sqrt{3}}{2} ympäri piirretyn ympyrän säde \dfrac{a\sqrt{3}}{3} \dfrac{a\sqrt{2}}{2} \dfrac{a}{10}\sqrt{50+10\sqrt{5}} pinta-ala \dfrac{{{a}^{2}}\sqrt{3}}{4} a^2 \dfrac{{{a}^{2}}}{4}\sqrt{25+10\sqrt{5}} \dfrac{3{{a}^{2}}\sqrt{3}}{2} ympyrä kehän pituus p = 2πr pinta-ala A= \pi r^2 sektorin kaaren pituus b=\dfrac{\alpha }{360^\circ }2\pi r sektorin pinta-ala A=\dfrac{\alpha }{360^\circ }\pi {{r}^{2}}=\dfrac{br}{2} segmentin pinta-ala = sektorin ala − keskuskolmion ala jos 0° < α ≤ 180° = sektorin ala + keskuskolmion ala jos 180° < α < 360° ellipsi pinta-ala a = πab  suorakulmainen kolmio tasasivuinen kolmio tasakylkinen kolmio a ja b ovat kateetteja c on hypotenuusa sivut ovat yhtä pitkätkulmat yhtä suuret kyljet ovat yhtä pitkätkantakulmat yhtä suuret heronin kaava A=\sqrt{p(p-a)(p-b)(p-c)},\text{ jossa }p=\dfrac{a+b+c}{2}; 13730057973139; Tasokuvioita; body
kompleksin nimessä mainitaan ensin negatiiviset ligandit sitten neutraalit ligandit ja lo­­puksi keskusatomi neutraalin tai positiivisen kompleksin nimi päättyy perusmuodossa olevaan keskusatomin nimeen negatiivisen kompleksin nimen viimeisenä osa­­na on keskus­atomin nimi vierasperäisessä muodossa sekä pääte -aatti kaava nimi väri \left[\text{Ag(NH}_3\text{)}_2\right]^{+} diammiinihopea-ioni väritön \left[\text{Al(OH)}_4\right]^{-} tetrahydroksoaluminaatti-ioni väritön \left[\text{Co(H}_2\text{O)}_6\right]^{2+} heksa-akvakoboltti(ii)-ioni punainen \left[\text{Cu(H}_2\text{O)}_4\right]^{2+} tetra-akvakupari(ii)-ioni sininen \left[\text{Cu(NH}_3\text{)}_4\right]^{2+} tetra-ammiinikupari(ii)-ioni sininen \left[\text{Fe(CN)}_6\right]^{4-} heksasyanoferraatti(ii)-ioni keltainen \left[\text{Fe(CN)}_6\right]^{3-} heksasyanoferraatti(iii)-ioni punainen \left[\text{Fe(SCN)}\right]^{2+} tiosyanaattorauta(iii)-ioni verenpunainen \left[\text{Ni(NH}_3\text{)}_6\right]^{2+} heksa-ammiininikkeli(ii)-ioni sininen \left[\text{Pb(OH)}_4\right]^{2-} tetrahydroksoplumbaatti(ii)-ioni väritön \left[\text{PtCl}_6\right]^{2-} heksakloroplatinaatti(iv)-ioni keltainen \left[\text{Sn(OH)}_6\right]^{2-} heksahydroksostannaatti(iv)-ioni väritön \left[\text{Zn(H}_2\text{O)}_4\right]^{2+} tetra-akvasinkki-ioni väritön \left[\text{Zn(OH)}_4\right]^{2-} tetrahydroksosinkaatti-ioni väritön; 13754466498557; Kompleksi-ioneja; body
konnektiivi symboli luetaan negaatio ei p disjunktio p ∨ q p tai q konjunktio p ∧ q p ja q implikaatio p ⇒ q jos p niin q ekvivalenssi p ⇔ q p ja q yhtäpitäviä; 13730069837668; Konnektiivit; body
korkeuskm lämpötila°c ilmanpainembar Tiheys\text{kg/m}^3 merenpinta 0 15 1 013 1,22 2,0 795 1,01 701 0,91 616 0,82 540 0,73 10 260 0,41 15 120 0,19 20 55 8,8\cdot 10^{–2} 30 11 1,8\cdot 10^{–2} 40 2,8 3,9\cdot 10^{–3} 50 0,79 1,0\cdot 10^{–3} 100 3,0 \cdot 10^{–4} 4,9\cdot 10^{–7} 200 1 000 1,3\cdot 10^{–6} 3,3\cdot 10^{–10} 300 1 200 1,8\cdot 10^{–7} 3,5\cdot 10^{–11} 400 1 200 4,0\cdot 10^{–8} 6,4\cdot 10^{–12} 500 1 200 1,0\cdot 10^{–8} 1,5\cdot 10^{–12} 600 1 200 3,4\cdot 10^{–9} 4,6\cdot 10^{–13} 700 1 300 1,1\cdot 10^{–9} 1,5\cdot 10^{–13} 8,5 899 1,11; 13754414114296; Ilmakehän ominaisuuksia; body
kuiva ilma 15 °c 1,013 bar aallonpituusnm taitekerroin 200 1,000 3256 250 1,000 3014 300 1,000 2907 350 1,000 2850 400 1,000 2817 450 1,000 2796 500 1,000 2781 550 1,000 2771 600 1,000 2763 650 1,000 2758 700 1,000 2753 800 1,000 2746 900 1,000 2742 1 000 1,000 2739 1 500 1,000 2733 2 000 1,000 2730; 13754439242312; Ilman taitekerroin eri aallonpituuksille; body
kuutio a=s\sqrt{2} A=6{{s}^{2}} d=s\sqrt{3} V = s^3 d=\sqrt{{{a}^{2}}+{{b}^{2}}+{{c}^{2}}} v = ah V=\dfrac{1}{3}Ah A_{\text{v}}=\pi rs {A}_{\text{v}}=2\pi rh V=\dfrac{h}{3}({{A}_{1}}+\sqrt{{A_1}{A_2}}+{A_2}) V=\dfrac{\pi h}{3}({r}_{1}^{2}+{{r}_{1}}{{r}_{2}}+{r}_{2}^{2}) A=4\pi {{r}^{2}} a = 2πrh V=\dfrac{2}{3}\pi {{r}^{2}}h V=\dfrac{4}{3}\pi {{b}^{2}}a V=\dfrac{4}{3}\pi {{a}^{2}}b V=\dfrac{1}{2}\pi {r}^{2}h suorakulmainen särmiö a = 2(ab + ac + bc v = abc lieriö kartio suora ympyräkartio V=\dfrac{1}{3}\pi {{r}^{2}}h suora ympyrälieriö A_{\text{kok}}={{A}_{\text{v}}}+2\pi {{r}^{2}}=2\pi r(r+h) V=\pi {{r}^{2}}h katkaistu kartio katkaistu ympyräkartio V=\dfrac{4}{3}\pi {{r}^{3}} vyöhyke kalotti ja segmentti V=\pi {{h}^{2}}\left(r-\dfrac{h}{3}\right) pallosektori pyörähdysellipsoidi pyörähdysparaboloidi säännölliset monitahokkaat tetraedri heksaedri = kuutio oktaedri dodekaedri ikosaedri monitahokkaan särmä a rajapinta 4 kolmiota 6 neliötä 8 kolmiota 12  5-kulmiota 20 kolmiota pinta-ala  {{a}^{2}}\sqrt{3} 6a^2  2{{a}^{2}}\sqrt{3}   3{{a}^{2}}\sqrt{5(5+2\sqrt{5})}  5{{a}^{2}}\sqrt{3} tilavuus  \dfrac{{{a}^{3}}\sqrt{2}}{12} a^3  \dfrac{{{a}^{3}}\sqrt{2}}{3}  \dfrac{{{a}^{3}}(15+7\sqrt{5})}{4}  \dfrac{5{{a}^{3}}(3+\sqrt{5})}{12} pallo; 13730057987950; Avaruuskappaleita; body
kuvassa on esitetty suomessa 60 leveyspiirillä näkyvä tähtitaivas horisontin yläpuolella oleva osa riippuu vuoden ja vuorokauden ajoista katkoviivan rajaama alue näkyy esim 1.9 klo 21; 13754452180971; Pohjoinen tähtitaivas; body
käytössä olevien tai käytöstä poistettujen yksiköiden muuntaminen si-yksiköiksi 1′ 1 yd 1 mi 1 å 1 mpk 1 ly 1 pc 1 au 1 ka 1 u 1 t 1 lb 1 denier 1 tex 1 min 1 a 1° 1 gon 1 a 1 acre 1 l 1 bbl 1 gal 1 gal 1 rt 1 std 1 km/h 1 mach 1 kp 1 dyn 1 erg  1 ev 1 cal 1 kwh 1 kpm 1 u 1 kg 1 kpm/s 1 hv 1 kcal/h 1 bar 1 at 1 atm 1 torr 1 mmh2o 1 psi 1 p 1 d 1 mx 1 g 1 oe 1 ci 1 r 1 rd 1 rem pituus = 1 ångström = 10^{–10} \text{ m} = 0,1 nm = 1 atomimassayksikkö = 1,660 \, 539\, 066\, 60 \cdot 10^{–27} \text{ kg} = 1 vuosi ≈ 365 d = 31,536 \cdot 10^6 \text{ s} = 1 aari = 100 \text{ m}^2 = 1 eekkeri = 4,0469 \cdot 10^3 \text{ m}^2 = 1\text{ dm}^3 = 0,001 \text{ m}^3 = 1 barreli = 0,158 \ 9873 \text{ m}^3 = 1 rekisteritonni = 2,831 \ 685 \text{ m}^3 = 1 standartti = 4,672 \ 280 \text{ m}^3 = 1 elektronivoltti = 1,602 \ 176\ 634 \cdot 10^{–19} \text{ J} = 1 atomimassa = 149,241\ 809 \text{ pJ/c}^2 = 931,494 \ 102 \text{ MeV/c}^2 = 1 kilogramma = 89,875 \ 518 \text{ PJ/c}^2 = 1 baari = 10^5 \text{ Pa} = 1 tekninen ilmakehä = 1 \text{ kp/cm}^2 = 98,0665 kPa = 1 poundaalia/neliötuuma = 1 \text{ lbf/in}^2 = 6,894 \ 757 \cdot 10^3 \text{ Pa} = 1 poisi = 0,1 \text{ Ns/m}^2 = 1 örsted = \dfrac{10^3}{4 \pi} \text{ A/m} = 79,577 A/m = 1 curie = 3,7 \cdot 10^{10} \text{ 1/s} = 37 GBq 1″ massa pituusmassa aika tasokulma pinta-ala tilavuus nopeus voima työ energia massan ja energian vastaavuus teho paine viskositeetti taittovoimakkuus magneettivuo magneettivuon tiheys magneettikentän voimakkuus ionisoiva säteilyaktiivisuus säteilytys absorboitunut annos annosekvivalentti 1 oz 1 h 1 d 1' 1" 1 solmu 1 lbf 1 ha = 1 hehtaari = 10 \ 000 \text{ m}^2 1 b = 1 barni = 10^{–28} \text{ m}^2; 13754410898253; Muuntokertoimia; body
l paulingin mukaan; 13754464594445; Elektronegatiivisuus; body
laite piirrosmerkki tasasähkö tasajännite tasavirta vaihtosähkö vaihtojännite vaihtovirta tasasuunnattu sähkö vaihtovirtakomponentti mukana maadoitus johdinliitos ohitus kytkin vaihtokytkin varoke sulake tasajännitelähde paristo akku vaihtojännitelähde virtamittari jännitemittari resistanssimittari lamppu vastus säätövastus potentiometri kondensaattori säätökondensaattori elektrolyyttikondensaattori käämi kela käämi rautasydän muuntaja generaattori moottori diodi triodi hohtolamppu valokenno puolijohdediodi fotodiodi zenerdiodi tunnelidiodi loistediodi led triodityristori diac triac ldr-vastus fotojännite-elementti aurinkokenno ntc-vastus ptc-vastus vdr jännitteestä riippuva vastus pnp-transistori npn-transistori valotransistori taajuusmuuttaja vahvistin mikropiiri rele lämpörele soittokello summeri mikrofoni kuuloke kaiutin antenni oskilloskooppi; 13754443911858; Sähköteknisiä piirrosmerkkejä; body
leveyspiiri gm/s2 9,7804 10 9,7820 20 9,7864 30 9,7933 40 9,8017 45 9,806 65 50 9,8107 60 9,8197 70 9,8261 80 9,8306 90 9,8322; 13754452220624; Putoamiskiihtyvyys merenpinnan tasolla; body
litium kalsium kupari natrium strontium rikki kalium barium; 13754489154925; Liekkivärejä; body
lorem ipsum dolor sit amet consectetur adipiscing elit sed in interdum ante sed elit ex blandit id lorem id ullamcorper egestas dolor sit amettest sarake 1 sarake 2 sarake 3 testi \sqrt{|xy|}\leq\left|\frac{x+y}{2}\right|\begin{bmatrix} 1 & x & 0 \\ 0 & 1 & -1 \end{bmatrix} \begin{bmatrix} 1 \\ y \\ 1 \end{bmatrix}Sed in interdum ante. Sed elit ex, blandit id lorem id, ullamcorper egestas dolor. \lim_{x \to a} \frac{f(x) - f(a)}{x - a} %\lim_{x \to a} \frac{f(x) - f(a) x - a} väliotsikko  \int_a^bu\frac{d^2v}{dx^2}\,dx =\left.u\frac{dv}{dx}\right|_a^b -\int_a^b\frac{du}{dx}\frac{dv}{dx}\,dx. sarake 1 sarake 2 kaava 1 \begin{cases} 0, & x \lt 0 \\ V_0, & 0 \leq x \lt L \\ 0, & x \geq L \end{cases}\sum_{n=0}^\infty a_n x^n kaava 2 kaava 3 kaava 4 \sum_{n=0}^\infty a_n x^n \sum_{n=0}^\infty a_n x^n; 15634263087517; Testidokumentti; body
lyhenne merkitys adp adenosiinidifosfaatti atp adenosiinitrifosfaatti cfc fluorikloori­hiilivety ddt diklooridifenyylitri­kloorietaani dna deoksiribonukleiinihappo edta etyleenidiamiinitetra­etikkahappo pa polyamidi pah polyaromaatti­nen hiilivety pcb polykloorattu bifenyyli pet polyetyleenitereftalaatti pp polypropeeni ps polystyreeni pvc polyvinyylikloridi rna ribonukleiinihappo pe polyeteeni; 13754489011811; Yleisesti käytettyjä nimilyhenteitä; body
lämpötila 20 °c ja normaalipaine ellei toisin mainita tiheys 998,20 \ \text{kg/m}^3 moolimassa 18,0152 kg/kmol sulamispiste 0,00 °c = 273,15 k kiehumispiste 100,0 °c = 373,15 k kolmoispiste 0,01 °c = 273,16 k 611,7 pa = 6,117 mbar kriittinen piste 373,95 °c = 647,1 k 22,064 mpa = 220,64 bar tilavuuden lämpötilakerroin 0,207 \cdot 10^{–3} \text{ l/K} ominaislämpökapasiteetti jää 2,09 \ \dfrac{\text{kJ}}{\text{kg} \cdot \text{K}} (0,0 °C) ominaislämpökapasiteetti vesi 4,1819 \ \dfrac{\text{kJ}}{\text{kg} \cdot \text{K}} (4,19 \ \dfrac{\text{kJ}}{\text{kg} \cdot \text{K}},\ 0\!-\!100\ {}^\circ \text{C}) ominaissulamislämpö 333 kj/kg ominaishöyrystymislämpö 2 260 kj/kg 100 °c viskositeetti 1,002 \cdot 10^{-3} \text{ Ns/m}^2 pintajännitys ilma–vesi 72,75 \cdot 10^{-3} \text{ N/m} puristuvuus 454 \cdot 10^{-12} \text{ l/Pa} lämmönjohtavuus 597 \dfrac{\text{mW}}{\text{m} \cdot \text{K}} taitekerroin ilma–vesi 589,3 nm 1,3330 läpilyöntikestävyys 30 kv/mm suhteellinen permittiivisyys tasajännite 80,10 suhteellinen permeabiliteetti 0,999 9910; 13754412705417; Veden ominaisuuksia; body
lämpötila k metalli volframi 0,0154 osmium 0,66 sinkki 0,85 alumiini 1,175 indium 3,41 tina 3,72 elohopea 4,15 vanadiini 5,40 lyijy 7,196 niobium 9,25 lejeerinki pb-in pb-bi 8,3 nb-zr 10,7 nbn 16,1 v3ga 16,8 v3si 17,1 nb3sn 18,1 nb3ge 23,2 keraaminen aine la1,85ba0,15)cuo4 30 yba4cu7o16 96 gasr2(ca0,5tm0,5)cu2o7 99 casrcu2o4 110 fulleriini cs2rbc60 33 tl2ba2ca2cu3o10 127–128 hgba2ca2cu3o8 133–135; 13754443767537; Suprajohteita; body
lämpötila °c Tiheys\text{g/cm}^3 0,999 84 0,999 90 jään sulamispisteen riippuvuus paineesta ominaislämpökapasiteetin cp riippuvuus lämpötilasta veden taitekertoimen riippuvuus valon aallonpituudesta 0,999 94 0,999 96 0,999 973 0,999 96 0,999 94 0,999 90 0,999 85 0,999 78 10 0,999 70 11 0,999 60 12 0,999 50 13 0,999 38 14 0,999 24 15 0,999 10 16 0,998 94 17 0,998 77 18 0,998 60 19 0,998 41 20 0,998 20 22 0,997 78 24 0,997 30 26 0,996 79 28 0,996 24 30 0,995 65 35 0,994 04 40 0,992 22 45 0,990 22 50 0,988 05 60 0,983 22 70 0,977 79 80 0,971 81 90 0,965 32 100 0,958 36 veden tiheyden riippuvuus lämpötilasta veden kiehumispisteen riippuvuus paineesta lämpötila ja jään höyrynpaine veden ominaishöyrystymislämmön riippuvuus kiehumispisteestä; 13754412721586; Veden tiheys lämpötiloissa 0 °C – 100 °C; body
