trigonometristen funktioiden väliset yhteydet ttrigonometristen trigonometristenn trigonometristen yrigonometristen ttigonometristen trogonometristen trihonometristen trigpnometristen trigomometristen trigonpmetristen trigononetristen trigonomrtristen trigonomeyristen trigonomettisten trigonometrosten trigonometridten trigonometrisyen trigonometristrn trigonometristem grigonometristen tfigonometristen trkgonometristen tribonometristen triglnometristen trigobometristen trigonlmetristen trigonoketristen trigonomdtristen trigonomegristen trigonometfisten trigonometrksten trigonometrixten trigonometrisgen trigonometristdn trigonometristeb trgonometrsten trgonometristen trignmetristen trignometristen trigonmetristen trigonomtristn trigonomtristen trigonometrsten trigonometristn trgnmtrstn ffunktioiden funktioidenn funktioiden gunktioiden finktioiden fumktioiden funltioiden funkyioiden funktooiden funktipiden funktiooden funktioifen funktioidrn funktioidem vunktioiden fjnktioiden fubktioiden funjtioiden funkgioiden funktkoiden funktiliden funktiokden funktioicen funktioiddn funktioideb fnktioiden funktoden funktoiden funktiiden funktioden funktioidn fnktdn vväliset välisett väliset bäliset v'liset väöiset väloset välidet välisrt välisey cäliset völiset vä:iset välkset välixet välisdt väliseg vliset välset välist vlst yyhteydet yhteydett yhteydet uhteydet yjteydet yhyeydet yhtrydet yhteudet yhteyfet yhteydrt yhteydey hhteydet ynteydet yhgeydet yhtdydet yhtehdet yhteycet yhteyddt yhteydeg htedet hteydet yhtydt yhtydet yhtedet yhteydt htdt; 13730058377664; Trigonometristen funktioiden väliset yhteydet; document
turvallisuusrajat turvalisuusrajat turvallisusrajat tturvallisuusrajat turvallisuusrajatt turvalisusrajat yurvallisuusrajat tirvallisuusrajat tutvallisuusrajat turballisuusrajat turvsllisuusrajat turvaölisuusrajat turvalöisuusrajat turvallosuusrajat turvalliduusrajat turvallisiusrajat turvallisuisrajat turvallisuudrajat turvallisuustajat turvallisuusrsjat turvallisuusrakat turvallisuusrajst turvallisuusrajay gurvallisuusrajat tjrvallisuusrajat tufvallisuusrajat turcallisuusrajat turvzllisuusrajat turva:lisuusrajat turval:isuusrajat turvallksuusrajat turvallixuusrajat turvallisjusrajat turvallisujsrajat turvallisuuxrajat turvallisuusfajat turvallisuusrzjat turvallisuusramat turvallisuusrajzt turvallisuusrajag trvallissrajat trvallisuusrajat turvllisuusrjt turvllisuusrajat turvallsuusrajat turvallisuusrjat turvallisuusrajt trvllssrjt; 13754442681062; Turvallisuusrajat; document
tähtisumuja ttähtisumuja tähtisumujaa tähtisumuja yähtisumuja t'htisumuja täjtisumuja tähyisumuja tähtosumuja tähtidumuja tähtisimuja tähtisunuja tähtisumija tähtisumuka tähtisumujs gähtisumuja töhtisumuja täntisumuja tähgisumuja tähtksumuja tähtixumuja tähtisjmuja tähtisukuja tähtisumjja tähtisumuma tähtisumujz thtisumuja tähtsumuja tähtismja tähtismuja tähtisumja tähtisumuj thtsmj; 13754452131986; Tähtisumuja; document
ultraviolettivalo ultravioletivalo uultraviolettivalo ultraviolettivaloo iltraviolettivalo uötraviolettivalo ulyraviolettivalo ulttaviolettivalo ultrsviolettivalo ultrabiolettivalo ultravoolettivalo ultraviplettivalo ultravioöettivalo ultraviolrttivalo ultravioleytivalo ultravioletyivalo ultraviolettovalo ultraviolettibalo ultraviolettivslo ultraviolettivaöo ultraviolettivalp jltraviolettivalo u:traviolettivalo ulgraviolettivalo ultfaviolettivalo ultrzviolettivalo ultraciolettivalo ultravkolettivalo ultravillettivalo ultravio:ettivalo ultravioldttivalo ultraviolegtivalo ultravioletgivalo ultraviolettkvalo ultravioletticalo ultraviolettivzlo ultraviolettiva:o ultraviolettivall ltraviolettivalo ultrviolettivlo ultrviolettivalo ultravolettvalo ultravolettivalo ultravilettival ultravilettivalo ultraviolttivalo ultraviolettvalo ultraviolettivlo ltrvlttvl; 13754439197405; Ultraviolettivalo; document
vakioita vvakioita vakioitaa vakioita bakioita vskioita valioita vakooita vakipita vakioota vakioiya vakioits cakioita vzkioita vajioita vakkoita vakilita vakiokta vakioiga vakioitz vkioit vkioita vakota vakoita vakiita vakiota vkt; 13754462284282; Vakioita; document
varoitusmerkit vvaroitusmerkit varoitusmerkitt varoitusmerkit baroitusmerkit vsroitusmerkit vatoitusmerkit varpitusmerkit varootusmerkit varoiyusmerkit varoitismerkit varoitudmerkit varoitusnerkit varoitusmrrkit varoitusmetkit varoitusmerlit varoitusmerkot varoitusmerkiy caroitusmerkit vzroitusmerkit vafoitusmerkit varlitusmerkit varoktusmerkit varoigusmerkit varoitjsmerkit varoituxmerkit varoituskerkit varoitusmdrkit varoitusmefkit varoitusmerjit varoitusmerkkt varoitusmerkig vroitusmerkit varitusmerkit varotusmerkt varotusmerkit varoitsmerkit varoitusmrkit varoitusmerkt vrtsmrkt; 13754489123075; Varoitusmerkit; document
vastusten värikoodit vvastusten vastustenn vastusten bastusten vsstusten vadtusten vasyusten vastisten vastudten vastusyen vastustrn vastustem castusten vzstusten vaxtusten vasgusten vastjsten vastuxten vastusgen vastustdn vastusteb vstusten vaststen vastustn vststn värikodit vvärikoodit värikooditt bärikoodit v'rikoodit vätikoodit värokoodit väriloodit värikpodit värikopdit värikoofit värikoodot värikoodiy cärikoodit vörikoodit väfikoodit värkkoodit värijoodit väriklodit värikoldit värikoocit värikoodkt värikoodig vrikoodit värkoodt värkoodit värikdit värikoodt vrkdt; 13754443885404; Vastusten värikoodit; document
veden ionitulo vveden vedenn veden beden vrden vefen vedrn vedem ceden vdden vecen veddn vedeb vdn vden vedn iionitulo ionituloo ionitulo oonitulo ipnitulo iomitulo ionotulo ioniyulo ionitilo ionituöo ionitulp konitulo ilnitulo iobitulo ionktulo ionigulo ionitjlo ionitu:o ionitull ontulo onitulo initul initulo iontulo ionitlo ntl; 13754487732871; Veden ionitulo; document
veden ominaisuuksia vveden vedenn veden beden vrden vefen vedrn vedem ceden vdden vecen veddn vedeb vdn vden vedn ominaisuksia oominaisuuksia ominaisuuksiaa pminaisuuksia oninaisuuksia omonaisuuksia omimaisuuksia ominsisuuksia ominaosuuksia ominaiduuksia ominaisiuksia ominaisuiksia ominaisuulsia ominaisuukdia ominaisuuksoa ominaisuuksis lminaisuuksia okinaisuuksia omknaisuuksia omibaisuuksia ominzisuuksia ominaksuuksia ominaixuuksia ominaisjuksia ominaisujksia ominaisuujsia ominaisuukxia ominaisuukska ominaisuuksiz minaisuuksia omnasuuksa omnaisuuksia ominisuuksi ominisuuksia ominasuuksia ominaisksia ominaisuuksa mnsks; 13754412705417; Veden ominaisuuksia; document
veden tiheys lämpötiloissa 0 °c – 100 °c vveden vedenn veden beden vrden vefen vedrn vedem ceden vdden vecen veddn vedeb vdn vden vedn ttiheys tiheyss tiheys yiheys toheys tijeys tihrys tiheus tiheyd giheys tkheys tineys tihdys tihehs tiheyx theys tihys tihes ths lämpötiloisa llämpötiloissa lämpötiloissaa öämpötiloissa l'mpötiloissa länpötiloissa lämåötiloissa lämpätiloissa lämpöyiloissa lämpötoloissa lämpötiöoissa lämpötilpissa lämpötiloossa lämpötiloidsa lämpötiloisda lämpötiloisss :ämpötiloissa lömpötiloissa läkpötiloissa lämöötiloissa lämp-tiloissa lämpögiloissa lämpötkloissa lämpöti:oissa lämpötillissa lämpötilokssa lämpötiloixsa lämpötiloisxa lämpötiloissz lmpötiloissa lämptiloissa lämpötlossa lämpötloissa lämpötilissa lämpötilossa lämpötiloiss lmptlss 00 0 °°c °cc °c °v °x –– – 10 1100 1000 100 °°c °cc °c °v °x; 13754412721586; Veden tiheys lämpötiloissa 0 °C – 100 °C; document
vektorit koordinaatistossa vvektorit vektoritt vektorit bektorit vrktorit veltorit vekyorit vektprit vektotit vektorot vektoriy cektorit vdktorit vejtorit vekgorit vektlrit vektofit vektorkt vektorig vktorit vektrit vektort vktrt kordinaatistossa koordinatistossa koordinaatistosa kkoordinaatistossa koordinaatistossaa kordinatistoss loordinaatistossa kpordinaatistossa koprdinaatistossa kootdinaatistossa koorfinaatistossa koordonaatistossa koordimaatistossa koordinsatistossa koordinastistossa koordinaayistossa koordinaatostossa koordinaatidtossa koordinaatisyossa koordinaatistpssa koordinaatistodsa koordinaatistosda koordinaatistosss joordinaatistossa klordinaatistossa kolrdinaatistossa koofdinaatistossa koorcinaatistossa koordknaatistossa koordibaatistossa koordinzatistossa koordinaztistossa koordinaagistossa koordinaatkstossa koordinaatixtossa koordinaatisgossa koordinaatistlssa koordinaatistoxsa koordinaatistosxa koordinaatistossz krdinaatistssa koordnaatstossa koordnaatistossa koordintistoss koordinaatstossa koordinaatistssa krdntstss; 13730064439990; Vektorit koordinaatistossa; document
vektorit vvektorit vektoritt vektorit bektorit vrktorit veltorit vekyorit vektprit vektotit vektorot vektoriy cektorit vdktorit vejtorit vekgorit vektlrit vektofit vektorkt vektorig vktorit vektrit vektort vktrt; 13730012285056; Vektorit; document
yhtälön f(x) = 0 ratkaisu yyhtälön yhtälönn yhtälön uhtälön yjtälön yhyälön yht'lön yhtäöön yhtälän yhtälöm hhtälön yntälön yhgälön yhtölön yhtä:ön yhtäl-n yhtälöb htälön yhtlön yhtäln htln ff(x) f(x)) f(x) g(x) f(c) v(x) f(z) == = 00 0 rratkaisu ratkaisuu ratkaisu tatkaisu rstkaisu raykaisu ratlaisu ratksisu ratkaosu ratkaidu ratkaisi fatkaisu rztkaisu ragkaisu ratjaisu ratkzisu ratkaksu ratkaixu ratkaisj rtkisu rtkaisu ratkisu ratkasu ratkais rtks; 13730069098468; Yhtälön <i>f</i>(<i>x</i>) = 0 ratkaisu; document
yhtälöpari yyhtälöpari yhtälöparii yhtälöpari uhtälöpari yjtälöpari yhyälöpari yht'löpari yhtäööpari yhtäläpari yhtälöåari yhtälöpsri yhtälöpati yhtälöparo hhtälöpari yntälöpari yhgälöpari yhtölöpari yhtä:öpari yhtäl-pari yhtälööari yhtälöpzri yhtälöpafi yhtälöpark htälöpari yhtlöpari yhtälpari yhtälöpri yhtälöpar htlpr; 13730055278688; Yhtälöpari; document
yleinen juuri yyleinen yleinenn yleinen uleinen yöeinen ylrinen yleonen yleimen yleinrn yleinem hleinen y:einen yldinen yleknen yleiben yleindn yleineb leinen ylinn ylinen ylenen yleinn lnn juri jjuuri juurii kuuri jiuri juiri juuti juuro muuri jjuri jujri juufi juurk jri juur jr; 13730049739030; Yleinen juuri; document
yleisesti käytettyjä nimilyhenteitä yyleisesti yleisestii yleisesti uleisesti yöeisesti ylrisesti yleosesti yleidesti yleisrsti yleisedti yleisesyi yleisesto hleisesti y:eisesti yldisesti yleksesti yleixesti yleisdsti yleisexti yleisesgi yleisestk leisesti ylissti ylisesti ylesest ylesesti yleissti lsst käytetyjä kkäytettyjä käytettyjää läytettyjä k'ytettyjä käutettyjä käyyettyjä käytrttyjä käyteytyjä käytetyyjä käytettujä käytettykä käytettyj' jäytettyjä köytettyjä kähtettyjä käygettyjä käytdttyjä käytegtyjä käytetgyjä käytetthjä käytettymä käytettyjö kytettyj kytettyjä kätettjä kätettyjä käytttyjä käytettjä ktttj nnimilyhenteitä nimilyhenteitää nimilyhenteitä mimilyhenteitä nomilyhenteitä ninilyhenteitä nimolyhenteitä nimiöyhenteitä nimiluhenteitä nimilyjenteitä nimilyhrnteitä nimilyhemteitä nimilyhenyeitä nimilyhentritä nimilyhenteotä nimilyhenteiyä nimilyhenteit' bimilyhenteitä nkmilyhenteitä nikilyhenteitä nimklyhenteitä nimi:yhenteitä nimilhhenteitä nimilynenteitä nimilyhdnteitä nimilyhebteitä nimilyhengeitä nimilyhentditä nimilyhentektä nimilyhenteigä nimilyhenteitö nmlyhentetä nmilyhenteitä nimlyhenteitä nimilhenteitä nimilyhntitä nimilyhnteitä nimilyhentitä nimilyhentetä nimilyhenteit nmlhntt; 13754489011811; Yleisesti käytettyjä nimilyhenteitä; document
yleisimmät hapetusluvut yleisimät yyleisimmät yleisimmätt uleisimmät yöeisimmät ylrisimmät yleosimmät yleidimmät yleisommät yleisinmät yleisimnät yleisimm't yleisimmäy hleisimmät y:eisimmät yldisimmät yleksimmät yleiximmät yleiskmmät yleisikmät yleisimkät yleisimmöt yleisimmäg leisimmät ylisimmät ylesmmät ylesimmät yleismmät yleisimmt lsmmt hhapetusluvut hapetusluvutt hapetusluvut japetusluvut hspetusluvut haåetusluvut haprtusluvut hapeyusluvut hapetisluvut hapetudluvut hapetusöuvut hapetuslivut hapetuslubut hapetusluvit hapetusluvuy napetusluvut hzpetusluvut haöetusluvut hapdtusluvut hapegusluvut hapetjsluvut hapetuxluvut hapetus:uvut hapetusljvut hapetuslucut hapetusluvjt hapetusluvug hpetusluvut haptusluvut hapetslvt hapetsluvut hapetuslvut hapetusluvt hptslvt; 13754464580731; Yleisimmät hapetusluvut; document
ympyrä yympyrä ympyrää ympyrä umpyrä ynpyrä ymåyrä ympurä ympytä ympyr' hmpyrä ykpyrä ymöyrä ymphrä ympyfä ympyrö mprä mpyrä ymprä ympyr mpr; 13730064866893; Ympyrä; document
äänen intensiteettitasoja änen ääänen äänenn 'änen ä'nen äämen äänrn äänem öänen äönen ääben äändn ääneb nen äänn nn intensitettitasoja intensiteetitasoja iintensiteettitasoja intensiteettitasojaa intensitetitasoja ontensiteettitasoja imtensiteettitasoja inyensiteettitasoja intrnsiteettitasoja intemsiteettitasoja intenditeettitasoja intensoteettitasoja intensiyeettitasoja intensitrettitasoja intensiterttitasoja intensiteeytitasoja intensiteetyitasoja intensiteettotasoja intensiteettiyasoja intensiteettitssoja intensiteettitadoja intensiteettitaspja intensiteettitasoka intensiteettitasojs kntensiteettitasoja ibtensiteettitasoja ingensiteettitasoja intdnsiteettitasoja intebsiteettitasoja intenxiteettitasoja intenskteettitasoja intensigeettitasoja intensitdettitasoja intensitedttitasoja intensiteegtitasoja intensiteetgitasoja intensiteettktasoja intensiteettigasoja intensiteettitzsoja intensiteettitaxoja intensiteettitaslja intensiteettitasoma intensiteettitasojz ntensteetttasoja ntensiteettitasoja intnsitttitasoja intnsiteettitasoja intensteettitasoja intensiteetttasoja intensiteettitsoj intensiteettitsoja intensiteettitasja ntnsttttsj; 13754441826700; Äänen intensiteettitasoja; document
äänen nopeus väliaineessa änen ääänen äänenn 'änen ä'nen äämen äänrn äänem öänen äönen ääben äändn ääneb nen äänn nn nnopeus nopeuss nopeus mopeus nppeus noåeus noprus nopeis nopeud bopeus nlpeus noöeus nopdus nopejs nopeux npeus nopus nopes nps väliainessa väliaineesa vväliaineessa väliaineessaa väliainesa bäliaineessa v'liaineessa väöiaineessa väloaineessa välisineessa väliaoneessa väliaimeessa väliainressa väliainerssa väliaineedsa väliaineesda väliaineesss cäliaineessa völiaineessa vä:iaineessa välkaineessa välizineessa väliakneessa väliaibeessa väliaindessa väliainedssa väliaineexsa väliaineesxa väliaineessz vliaineessa välaneessa välaineessa väliineess väliineessa välianeessa väliainssa vlnss; 13754441809618; Äänen nopeus väliaineessa; document
äänen spektri änen ääänen äänenn 'änen ä'nen äämen äänrn äänem öänen äönen ääben äändn ääneb nen äänn nn sspektri spektrii spektri dpektri såektri sprktri speltri spekyri spektti spektro xpektri söektri spdktri spejtri spekgri spektfi spektrk spktri spektr spktr; 13754439283461; Äänen spektri; document
(2x+2)4n + 1 = 5x + 2a^23n+1(n^2 + k_n^2 - k_{n-1})a^{2} + ab + b^{2}Väliotsikko testitaulukko 1 sarake 1 sarake 2 1+1=2 testing testing testing test test test test1 test2test test testtest test test 2+2=4b^2Olkoon a, b \in \mathbb{R}, tällöin: (a+b)^{2} = a^{2} + ab + b^{2} test sarake 3 F(x) = \int^a_b \frac{1}{3}x^3f(x)=(x+b)(y+b) \begin{cases} 1 \\ 2 \end{cases}\begin{cases} 1 \\ 2 \end{cases} test test testikuva 1 test2 test1 testikuva 2; 15662159313367; Testidokumentti 3; body
1 ∀x ∈ e: f (x) ≥ 0 (2) \int\limits_{a}^{b}{f(x)\,\text{d}x}=1 (jos E = ℝ, niin ehto on \int\limits_{-\infty }^{\infty }{f(x)\,\text{d}x}=1) todennäköisyys \text{P}(X \in A)=\int\limits_{c}^{d}{f(x)\,\text{d}x}=F(d)-F(c) odotusarvo \text{E}(X)=\mu =\int\limits_{a}^{b}{xf(x)\,\text{d}x} keskihajonta \text{D}(X)=\sigma =\sqrt{\int\limits_{a}^{b}{{{(x-\mu )}^{2}}f(x)\,\text{d}x}}=\sqrt{\int\limits_{a}^{b}{{{x}^{2}}f(x)\text{d}x-{{\mu }^{2}}}} varianssi {{\sigma }^{2}}  jakauma määrittelyjoukko tiheysfunktio parametrin rajat odotusarvo keskihajonta normaalijakauma \dfrac{1}{\sigma \sqrt{2\pi }}{{\text{e}}^{-\tfrac{1}{2}{{\left( \tfrac{x-\mu }{\sigma } \right)}^{2}}}} normitettu normaalijakauma \dfrac{1}{\sqrt{2\pi }}{{\text{e}}^{-\tfrac{1}{2}{{x}^{2}}}} eksponenttijakauma a \text{e}^{-ax} a > 0 \dfrac{1}{a} \dfrac{1}{a} tasainen jakauma \dfrac{1}{b-a} b > a \dfrac{a+b}{2} \dfrac{b-a}{2\sqrt{3}} jatkuvia jakaumia jatkuvan satunnaismuuttujan x arvojoukko olkoon väli e =[a, b] kun a = [c, d] ⊂ e, niin x ∈ a eli c ≤ x ≤ d on tapahtuma satunnaismuuttujan x tiheysfunktiolle f pätee Muuttujaan liittyvä kertymäfunktio on F(x)=\text{P}(X\le x)=\int\limits_{a}^{x}{f(t)\,\text{d}t}.; 13730070883893; Jatkuva todennäköisyysjakauma; body
1) reaktiolle  \text{MS(s)}+\text{H}_2 \text{O} \rightleftharpoons \text{M}^{2+} \text{(aq)} + \text{HS}^- \text{(aq)} + \text{OH}^- \text{(aq)} Lähde: CRC Handbook of Chemistry and Physics, 84th edition aine ks bromideja agbr 5,4 \cdot 10^{-13} \text{PbBr}_2 6,6 \cdot 10^{-6} fluorideja \text{CaF}_2 3,5 \cdot 10^{-11} \text{PbF}_2 3,3 \cdot 10^{-8} fosfaatteja \text{Ag}_3 \text{PO}_4 8,9 \cdot 10^{-17} \text{Ca}_3 \text{(PO}_4 \text{)}_2 2,1 \cdot 10^{-33} hydroksideja \text{Al(OH)}_3 1,3 \cdot 10^{-33} \text{Ba(OH)}_2 \cdot 8 \ \text{H}_2 \text{O} 2,6 \cdot 10^{-4} \text{Ca(OH)}_2 5,0 \cdot 10^{-6} \text{Fe(OH)}_2 4,9 \cdot 10^{-17} \text{Fe(OH)}_3 2,8 \cdot 10^{-39} \text{Mg(OH)}_2 5,6 \cdot 10^{-12} \text{Pb(OH)}_2 1,4 \cdot 10^{-20} \text{Zn(OH)}_2 3 \cdot 10^{-17} jodideja agi 8,5 \cdot 10^{-17} \text{PbI}_2 9,8 \cdot 10^{-9} karbonaatteja \text{BaCO}_3 2,6 \cdot 10^{-9} \text{CaCO}_3 3,4 \cdot 10^{-9} \text{PbCO}_3 7,4 \cdot 10^{-14} klorideja agcl 1,8 \cdot 10^{-10} \text{Hg}_2 \text{Cl}_2 1,4 \cdot 10^{-18} \text{PbCl}_2 1,7 \cdot 10^{-5} kromaatteja \text{Ag}_2 \text{CrO}_4 1,1 \cdot 10^{-12} \text{BaCrO}_4 1,2 \cdot 10^{-10} \text{PbCrO}_4 2,8 \cdot 10^{-13} oksalaatteja \text{Ag}_2 \text{C}_2 \text{O}_4 5,4 \cdot 10^{-12} \text{CaC}_2 \text{O}_4 \cdot \text{H}_2 \text{O} 2,3 \cdot 10^{-9} sulfaatteja \text{BaSO}_4 1,1 \cdot 10^{-10} \text{CaSO}_4 4,9 \cdot 10^{-5} \text{PbSO}_4 2,5 \cdot 10^{-8} sulfideja1 \text{Ag}_2 \text{S} 6 \cdot 10^{-51} cus 6 \cdot 10^{-37} fes 6 \cdot 10^{-19} hgs 2 \cdot 10^{-53} pbs 3 \cdot 10^{-28} zns 2 \cdot 10^{-25}; 13754466600159; Liukoisuustuloja; body
1. (1+x)^\alpha=1+\alpha x+\dfrac{\alpha (\alpha -1)}{2!}{{x}^{2}}+\dfrac{\alpha (\alpha -1)(\alpha -2)}{3!}{{x}^{3}}+\ldots +{\left( \begin{align} & \alpha \\ & n \\ \end{align} \right)}{{x}^{n}}+\ldots, jossa \alpha \in \mathbb{R}, n\in \mathbb{N} ja \left( \begin{align} & \alpha \\ & n \\ \end{align} \right)=\dfrac{\alpha (\alpha -1)\ldots (\alpha -n+1)}{n!}, suppenee, kun \left| x \right|<1. 2. \displaystyle(1+x)^n=1 + {n \choose 1}x + {n \choose 2}x^2+{n \choose 3}x^3+ \dots + {n \choose {n-1}}x^{n-1}+x^nSaadaan edellisestä, kun \alpha = n \in \mathbb{N}, ks. binomikaava artikkelista "Numeerisia taulukoita: Binomikertoimet (Pascalin kolmio)". 3. {\text{e}^{x}}=1+\dfrac{x}{1!}+\dfrac{{{x}^{2}}}{2!}+\dfrac{{{x}^{3}}}{3!}+\ldots  4. \ln (1+x)=x-\dfrac{1}{2}{{x}^{2}}+\dfrac{1}{3}{{x}^{3}}-\dfrac{1}{4}{{x}^{4}}+\ldots  5. \sin x=x-\dfrac{{{x}^{3}}}{3!}+\dfrac{{{x}^{5}}}{5!}-\dfrac{{{x}^{7}}}{7!}+\ldots  6. \cos x=1-\dfrac{{{x}^{2}}}{2!}+\dfrac{{{x}^{4}}}{4!}-\dfrac{{{x}^{6}}}{6!}+\ldots  7. \tan x=x+\dfrac{{{x}^{3}}}{3}+\dfrac{2{{x}^{5}}}{15}+\dfrac{17{{x}^{7}}}{315}+\ldots   \left| x \right|<\dfrac{\pi }{2} 8. \arcsin x=x+\dfrac{{{x}^{3}}}{6}+\dfrac{3{{x}^{5}}}{40}+\dfrac{5{{x}^{7}}}{112}+\ldots  9. \arctan x=x-\dfrac{{{x}^{3}}}{3}+\dfrac{{{x}^{5}}}{5}-\dfrac{{{x}^{7}}}{7}+\ldots  10. {{P}_{n}}(x)=f(a)+{f}'(a)(x-a)+\dfrac{{f}''(a)}{2!}{{(x-a)}^{2}}+\ldots +\dfrac{{{f}^{(n)}}(a)}{n!}{{(x-a)}^{n}}Virhe R_{n+1}(x)=\dfrac{{{f}^{(n+1)}}(t)}{(n+1)!}{{(x-a)}^{n+1}}, jossa t on vakion a ja muuttujan x välillä oleva luku. taylorin polynomi; 13730055334262; Sarjakehitelmiä; body
1. \int{kf(x)\text{d}x}=k\int{f(x)\text{d}x} 2. \int{(f(x)+g(x))\,\text{d}x}=\int{f(x)\,\text{d}x}+\int{g(x)\,\text{d}x} 3.	\int{{f}'(x)g(x)\,\text{d}x}=f(x)g(x)-\int{{g}'(x)f(x)\,\text{d}x} (osittaisintegrointi) 4. \int{{f}'(x)\,{g}'(f(x))\,\text{d}x}=g(f(x))+C; 13730066704675; Määräämättömään integraaliin liittyviä sääntöjä; body
1. dk = 0  k on vakio 2. dkf(x) = kf ′(x 3. d(f (x) + g(x)) = f ′(x)+ g′(x 4. df (x)g(x) = f ′(x) g(x) + f (x)g′(x 5. \text{D}\dfrac{f(x)}{g(x)}=\dfrac{{f}'(x)g(x)-f(x){g}'(x)}{{{(g(x))}^{2}}} 6. dg( f (x))= g′( f (x)) ⋅ f ′(x 7. ({{f}^{-1}})'(y_0)=\dfrac{1}{f'(x_0)}, jossa y_0=f(x_0); 13730065703784; Derivoimissääntöjä; body
100 200 300 400 500 600 700 800 3 · 67 7 · 43 3 · 167 3^{2} \cdot 89 7 · 29 3 · 101 13 · 31 3^{2} \cdot 67 19 · 37 11 · 73 3 · 5 · 7 5 · 41 5 · 61 3^{4} \cdot 5 5 · 101 5 \cdot 11^2 3 · 5 · 47 5 · 7 · 23 3^{2} \cdot 23 11 · 37 3 \cdot 13^{2} 7 · 101 3 · 269 3^{2} 11 · 19 3 · 103 3 · 7 · 29 11 3 · 37 3 · 137 7 · 73 13 · 47 3^{2} \cdot 79 13 3 · 71 7 · 59 3^{3} \cdot 19 23 · 31 3 · 271 15 3 · 5 5 · 23 5 · 43 3^{2} \cdot 5 \cdot 7 5 · 83 5 · 103 3 · 5 · 41 5 · 11 · 13 5 · 163 17 3^{2} \cdot 13 7 · 31 3 · 139 11 · 47 3 · 239 19 · 43 19 7 · 17 3 · 73 11 · 29 3 · 173 3^{2} \cdot 7 \cdot 13 21 3 · 7 11^{2} 13 · 17 3 · 107 3^{2} \cdot 23 7 · 103 23 3 · 41 17 · 19 3^{2} \cdot 47 7 · 89 3 · 241 25 5^{2} 5^{3} 3^{2} \cdot 5^{2} 5^{2} \cdot 13 5^{2} \cdot 17 3 \cdot 5^{2} \cdot 7 5^{4} 5^{2} \cdot 29 3 \cdot 5^{2} \cdot 11 27 3^3 3 · 109 7 · 61 17 · 31 3 · 11 · 19 29 3 · 43 7 · 47 3 · 11 · 13 23^{2}  17 · 37 3^{6} 36 31 3 · 7 · 11 3^{2} \cdot 59 17 · 43 3 · 277 33 3 · 11 7 · 19 3^{2} \cdot 37 13 · 41 3 · 211 7^{2} \cdot 17 35 5 · 7 3^{3} \cdot 5 5 · 47 5 · 67 3 · 5 · 29 5 · 107 5 · 127 3\cdot 5 \cdot 7^{2} 5 · 167 37 3 · 79 19 · 23 3 · 179 7^{2} \cdot 13 11 · 67 3^{3} \cdot 31 39 3 · 13 3 · 113 7^{2} \cdot 11 3^{2} \cdot 71 41 3 · 47 11 · 31 3^{2} \cdot 7^{2} 3 · 13 · 19 29^{2}292 43 11 · 13 3^{5} 7^{3} 3 · 181 3 · 281 45 3^{2} \cdot 5 5 · 29 5 \cdot 7^{2} 3 · 5 · 23 5 · 89 5 · 109 3 · 5 · 43 5 · 149 5 \cdot 13^{2} 47 3 \cdot 7^{2} 13 · 19 3 · 149 3^{2} \cdot 83 7\cdot 11^{2} 49 7^{2} 3 · 83 3^{2} \cdot 61 11 · 59 7 · 107 3 · 283 51 3 · 17 3^{3} \cdot 13 11 · 41 19 · 29 3 · 7 · 31 23 · 37 53 3^{2} \cdot 17 11 · 23 3 · 151 7 · 79 3 · 251 55 5 · 11 5 · 31 3 · 5 · 17 5 · 71 5 · 7 · 13 3 · 5 · 37 5 · 131 5 · 151 5 \cdot 3^{2} \cdot 19 57 3 · 19 3 · 7 · 17 3^{2} \cdot 73 59 3 · 53 7 · 37 3^{3} \cdot 17 13 · 43 3 · 11 · 23 61 7 · 23 3^{2} \cdot 29 19^{2} 3 · 11 · 17 3 · 7 · 41 63 3^{2} \cdot 7 3 \cdot 11^{2} 3 · 13 · 17 7 · 109 65 5 · 13 3 · 5 · 11 5 · 53 5 · 73 3 · 5 · 31 5 · 113 5 · 7 · 19 3^{2} \cdot 5 \cdot 17 5 · 173 67 3 · 89 3^{4} \cdot 7 23 · 29 13 · 59 3 \cdot 17^{3} 69 3 · 23 13^{2} 3^{2} \cdot 41 7 · 67 3 · 223 11 · 79 71 3^{2} \cdot 19 7 · 53 3 · 157 11 · 61 3 · 257 13 · 67 73 3 · 7 · 13 11 · 43 3 · 191 3^{2} \cdot 97 75 3 \cdot 5^{2} 5^{2} \cdot 7 5^{2} \cdot 11 3 \cdot 5^{3} 5^{2} \cdot 19 5^{2} \cdot 23 3^{3} \cdot 5^{2} 5^{2} \cdot 31 5^{3} \cdot 7 77 7 · 11 3 · 59 13 · 29 3^{2} \cdot 53 3 · 7 · 37 79 3^{2} \cdot 31 3 · 193 7 · 97 19 · 41 3 · 293 81 34 3 · 127 13 · 37 7 · 83 3 · 227 11 · 71 83 3 · 61 3 · 7 · 23 11 · 53 3^{3} \cdot 29 85 5 · 17 5 · 37 3 · 5 · 19 5 · 7 · 11 5 · 97 3^{2} \cdot 5 \cdot 13 5 · 137 5 · 157 3 · 5 · 59 87 3 · 29 11 · 17 7 · 41 3^{2} \cdot 43 3 · 229 89 3^{3} \cdot 7 17^{2} 3 · 163 19 · 31 13 · 53 3 · 263 7 · 127 91 7 · 13 3 · 97 17 · 23 3 · 197 7 · 113 3^{4} \cdot 11 93 3 · 31 3 · 131 17 · 29 3^{2} \cdot 7 13 · 61 19 · 47 95 5 · 19 3 · 5 · 13 5 · 59 5 · 79 3^{2} \cdot 5 \cdot 11 5 · 7 · 17 5 · 139 3 · 5 · 53 5 · 179 97 3^{3} \cdot 11 7 · 71 3 · 199 17 · 41 3 · 13 · 23 99 3^{2} \cdot 11 13 · 23 3 · 7 · 19 3 · 233 17 · 47 29 · 31 900 17 · 53 3 · 7 · 43 5 · 181 3^{2} \cdot 101 11 · 83 3 · 5 · 61 7 · 131 3 · 307 13 · 71 5^{2} \cdot 37 3^{2} \cdot 103 7^{2} \cdot 19 3 · 311 5 · 11 · 17 3 · 313 23 · 41 3^{3} \cdot 5 \cdot 7 13 · 73 3 · 317 5 · 191 3 · 11 · 29 7 · 137 31^{2} 3^{2} \cdot 107 5 · 193 3 · 17 · 19 7 · 139 3 \cdot 5^{2} \cdot 13 11 · 89 3^{2} \cdot 109 5 · 197 3 · 7 · 47 23 · 43 3 · 331 5 · 199 3^{3} \cdot 37; 13730071854201; Lukujen 1–999 alkutekijät; body
21.  \int\limits_{a}^{c}{f(x)\text{d}x}=\int\limits_{a}^{b}{f(x)\text{d}x}+\int\limits_{b}^{c}{f(x)\text{d}x} 22.  \int\limits_{a}^{a}{f(x)\text{d}x}=0 23.  \int\limits_{a}^{b}{f(x)\text{d}x}=-\int\limits_{b}^{a}{f(x)\text{d}x} 24.	 \int\limits_{a}^{b}{f(x)\text{d}x}\ge \int\limits_{a}^{b}{g(x)\text{d}x}, jos f(x) ≥ g(x) integroimisvälillä 25.	 \int\limits_{a}^{b}{{f}'(x)g(x)\text{d}x}=\underset{a}{\overset{b}{\mathop /}}\,f(x)g(x)-\int\limits_{a}^{b}{{g}'(x)f(x)\text{d}x}  (osittaisintegrointi) 26.	 \int\limits_{-a}^{a}{f(x)\,\text{d}x}=2\int\limits_{0}^{a}{f(x)\text{d}x}, jos f (x) on parillinen: f (−x) = f (x) 27.  \int\limits_{-a}^{a}{f(x)\text{d}x}=0, jos f (x) on pariton: f (−x) = −f (x) 28.	\displaystyle \int\limits_{a}^{\infty }{f(x)\text{d}x}=\underset{k\to \infty }{\mathop{\lim }}\int\limits_{a}^{k}{f(x)\text{d}x} (epäoleellinen integraali) 29.	\displaystyle \int\limits_{-\infty \ }^{b}{f(x)\text{d}x}=\underset{k\to -\infty }{\mathop{\lim }}\int\limits_{k}^{b}{f(x)\text{d}x} (epäoleellinen integraali); 13730066739337; Määrättyyn integraaliin liittyviä sääntöjä; body
