muiden kiinteiden aineiden ominaisuuksia mmuiden muidenn muiden nuiden miiden muoden muifen muidrn muidem kuiden mjiden mukden muicen muiddn muideb miden muden muidn mdn kinteiden kkiinteiden kiinteidenn liinteiden kointeiden kionteiden kiimteiden kiinyeiden kiintriden kiinteoden kiinteifen kiinteidrn kiinteidem jiinteiden kkinteiden kiknteiden kiibteiden kiingeiden kiintdiden kiintekden kiinteicen kiinteiddn kiinteideb knteden kiintidn kiintiden kiinteden kiinteidn kntdn aaineiden aineidenn aineiden sineiden aoneiden aimeiden ainriden aineoden aineifen aineidrn aineidem zineiden akneiden aibeiden aindiden ainekden aineicen aineiddn aineideb ineiden aneden aneiden ainidn ainiden aineden aineidn ndn ominaisuksia oominaisuuksia ominaisuuksiaa pminaisuuksia oninaisuuksia omonaisuuksia omimaisuuksia ominsisuuksia ominaosuuksia ominaiduuksia ominaisiuksia ominaisuiksia ominaisuulsia ominaisuukdia ominaisuuksoa ominaisuuksis lminaisuuksia okinaisuuksia omknaisuuksia omibaisuuksia ominzisuuksia ominaksuuksia ominaixuuksia ominaisjuksia ominaisujksia ominaisuujsia ominaisuukxia ominaisuukska ominaisuuksiz minaisuuksia omnasuuksa omnaisuuksia ominisuuksi ominisuuksia ominasuuksia ominaisksia ominaisuuksa mnsks; 13754412357317; Muiden kiinteiden aineiden ominaisuuksia; document
muistikolmiot mmuistikolmiot muistikolmiott muistikolmiot nuistikolmiot miistikolmiot muostikolmiot muidtikolmiot muisyikolmiot muistokolmiot muistilolmiot muistikplmiot muistikoömiot muistikolniot muistikolmoot muistikolmipt muistikolmioy kuistikolmiot mjistikolmiot mukstikolmiot muixtikolmiot muisgikolmiot muistkkolmiot muistijolmiot muistikllmiot muistiko:miot muistikolkiot muistikolmkot muistikolmilt muistikolmiog mistikolmiot mustkolmot mustikolmiot muistkolmiot muistiklmit muistiklmiot muistikolmot muistikolmit mstklmt; 13730058305092; Muistikolmiot; document
muodostumislämpöjä mmuodostumislämpöjä muodostumislämpöjää muodostumislämpöjä nuodostumislämpöjä miodostumislämpöjä mupdostumislämpöjä muofostumislämpöjä muodpstumislämpöjä muododtumislämpöjä muodosyumislämpöjä muodostimislämpöjä muodostunislämpöjä muodostumoslämpöjä muodostumidlämpöjä muodostumisöämpöjä muodostumisl'mpöjä muodostumislänpöjä muodostumislämåöjä muodostumislämpäjä muodostumislämpökä muodostumislämpöj' kuodostumislämpöjä mjodostumislämpöjä muldostumislämpöjä muocostumislämpöjä muodlstumislämpöjä muodoxtumislämpöjä muodosgumislämpöjä muodostjmislämpöjä muodostukislämpöjä muodostumkslämpöjä muodostumixlämpöjä muodostumis:ämpöjä muodostumislömpöjä muodostumisläkpöjä muodostumislämööjä muodostumislämp-jä muodostumislämpömä muodostumislämpöjö modostmislämpöjä modostumislämpöjä mudstumislämpöjä mudostumislämpöjä muodstumislämpöjä muodostmislämpöjä muodostumslämpöjä muodostumislmpöj muodostumislmpöjä muodostumislämpjä mdstmslmpj; 13754466428290; Muodostumislämpöjä; document
muuntokertoimia muntokertoimia mmuuntokertoimia muuntokertoimiaa nuuntokertoimia miuntokertoimia muintokertoimia muumtokertoimia muunyokertoimia muuntpkertoimia muuntolertoimia muuntokrrtoimia muuntokettoimia muuntokeryoimia muuntokertpimia muuntokertoomia muuntokertoinia muuntokertoimoa muuntokertoimis kuuntokertoimia mjuntokertoimia mujntokertoimia muubtokertoimia muungokertoimia muuntlkertoimia muuntojertoimia muuntokdrtoimia muuntokeftoimia muuntokergoimia muuntokertlimia muuntokertokmia muuntokertoikia muuntokertoimka muuntokertoimiz mntokertoimia muuntkertimia muuntkertoimia muuntokrtoimia muuntokertimia muuntokertoma muuntokertomia muuntokertoima muuntokertoimi mntkrtm; 13754410898253; Muuntokertoimia; document
määritelmiä märitelmiä mmääritelmiä määritelmiää nääritelmiä m'äritelmiä mä'ritelmiä määtitelmiä määrotelmiä määriyelmiä määritrlmiä määriteömiä määritelniä määritelmoä määritelmi' kääritelmiä möäritelmiä mäöritelmiä määfitelmiä määrktelmiä määrigelmiä määritdlmiä määrite:miä määritelkiä määritelmkä määritelmiö mritelmi määrtelmä määrtelmiä määritlmiä määritelmä mrtlm; 13730064425382; Määritelmiä; document
määritelmä märitelmä mmääritelmä määritelmää nääritelmä m'äritelmä mä'ritelmä määtitelmä määrotelmä määriyelmä määritrlmä määriteömä määritelnä määritelm' kääritelmä möäritelmä mäöritelmä määfitelmä määrktelmä määrigelmä määritdlmä määrite:mä määritelkä määritelmö mritelm määrtelmä määritlmä mrtlm; 13730066689827; Määritelmä; document
määrätty integraali märätty määräty mmäärätty määrättyy märäty näärätty m'ärätty mä'rätty määtätty määr'tty määräyty määrätyy määrättu käärätty möärätty mäörätty määfätty määrötty määrägty määrätgy määrätth mrtty määrtty määrätt mrtt integrali iintegraali integraalii ontegraali imtegraali inyegraali intrgraali intehraali integtaali integrsali integrasli integraaöi integraalo kntegraali ibtegraali ingegraali intdgraali intebraali integfaali integrzali integrazli integraa:i integraalk ntegraal ntegraali intgraali integrli ntgrl; 13730066728767; Määrätty integraali; document
määrättyyn integraaliin liittyviä sääntöjä märättyyn määrätyyn määrättyn mmäärättyyn määrättyynn märätyy näärättyyn m'ärättyyn mä'rättyyn määtättyyn määr'ttyyn määräytyyn määrätyyyn määrättuyn määrättyun määrättyym käärättyyn möärättyyn mäörättyyn määfättyyn määröttyyn määrägtyyn määrätgyyn määrätthyn määrättyhn määrättyyb mrttyyn määrttyyn määrättn mrttn integraliin integraalin iintegraaliin integraaliinn integralin ontegraaliin imtegraaliin inyegraaliin intrgraaliin intehraaliin integtaaliin integrsaliin integrasliin integraaöiin integraaloin integraalion integraaliim kntegraaliin ibtegraaliin ingegraaliin intdgraaliin intebraaliin integfaaliin integrzaliin integrazliin integraa:iin integraalkin integraalikn integraaliib ntegraaln ntegraaliin intgraaliin integrliin ntgrln littyviä liityviä lliittyviä liittyviää lityviä öiittyviä loittyviä liottyviä liiytyviä liityyviä liittuviä liittybiä liittyvoä liittyvi' :iittyviä lkittyviä likttyviä liigtyviä liitgyviä liitthviä liittyciä liittyvkä liittyviö lttyvä liittviä liittyvä liittyvi lttv säntöjä ssääntöjä sääntöjää dääntöjä s'äntöjä sä'ntöjä säämtöjä säänyöjä sääntäjä sääntökä sääntöj' xääntöjä söäntöjä säöntöjä sääbtöjä säängöjä säänt-jä sääntömä sääntöjö sntöj sääntjä sntj; 13730066739337; Määrättyyn integraaliin liittyviä sääntöjä; document
määräämättömään integraaliin liittyviä sääntöjä märäämättömään määrämättömään määräämätömään määräämättömän mmääräämättömään määräämättömäänn märämättmään nääräämättömään m'äräämättömään mä'räämättömään määtäämättömään määr'ämättömään määrä'mättömään määräänättömään määrääm'ttömään määräämäytömään määräämätyömään määräämättämään määräämättönään määräämättöm'än määräämättömä'n määräämättömääm kääräämättömään möäräämättömään mäöräämättömään määfäämättömään määröämättömään määräömättömään määrääkättömään määräämöttömään määräämägtömään määräämätgömään määräämätt-mään määräämättökään määräämättömöän määräämättömäön määräämättömääb mrmttömn määräämttömään määräämättmään mrmttmn integraliin integraalin iintegraaliin integraaliinn integralin ontegraaliin imtegraaliin inyegraaliin intrgraaliin intehraaliin integtaaliin integrsaliin integrasliin integraaöiin integraaloin integraalion integraaliim kntegraaliin ibtegraaliin ingegraaliin intdgraaliin intebraaliin integfaaliin integrzaliin integrazliin integraa:iin integraalkin integraalikn integraaliib ntegraaln ntegraaliin intgraaliin integrliin ntgrln littyviä liityviä lliittyviä liittyviää lityviä öiittyviä loittyviä liottyviä liiytyviä liityyviä liittuviä liittybiä liittyvoä liittyvi' :iittyviä lkittyviä likttyviä liigtyviä liitgyviä liitthviä liittyciä liittyvkä liittyviö lttyvä liittviä liittyvä liittyvi lttv säntöjä ssääntöjä sääntöjää dääntöjä s'äntöjä sä'ntöjä säämtöjä säänyöjä sääntäjä sääntökä sääntöj' xääntöjä söäntöjä säöntöjä sääbtöjä säängöjä säänt-jä sääntömä sääntöjö sntöj sääntjä sntj; 13730066704675; Määräämättömään integraaliin liittyviä sääntöjä; document
neliöjuuri neliöjuri nneliöjuuri neliöjuurii meliöjuuri nrliöjuuri neöiöjuuri neloöjuuri neliäjuuri neliökuuri neliöjiuri neliöjuiri neliöjuuti neliöjuuro beliöjuuri ndliöjuuri ne:iöjuuri nelköjuuri neli-juuri neliömuuri neliöjjuri neliöjujri neliöjuufi neliöjuurk nliöjuuri nelöjuur nelöjuuri nelijuuri neliöjri nljr; 13730048992094; Neliöjuuri; document
nesteiden ja kaasujen ominaisuuksia nnesteiden nesteidenn nesteiden mesteiden nrsteiden nedteiden nesyeiden nestriden nesteoden nesteifen nesteidrn nesteidem besteiden ndsteiden nexteiden nesgeiden nestdiden nestekden nesteicen nesteiddn nesteideb nstidn nsteiden nestiden nesteden nesteidn nstdn jja jaa ja ka js ma jz j kasujen kkaasujen kaasujenn laasujen ksasujen kassujen kaadujen kaasijen kaasuken kaasujrn kaasujem jaasujen kzasujen kazsujen kaaxujen kaasjjen kaasumen kaasujdn kaasujeb ksujen kaasjen kaasujn ksjn ominaisuksia oominaisuuksia ominaisuuksiaa pminaisuuksia oninaisuuksia omonaisuuksia omimaisuuksia ominsisuuksia ominaosuuksia ominaiduuksia ominaisiuksia ominaisuiksia ominaisuulsia ominaisuukdia ominaisuuksoa ominaisuuksis lminaisuuksia okinaisuuksia omknaisuuksia omibaisuuksia ominzisuuksia ominaksuuksia ominaixuuksia ominaisjuksia ominaisujksia ominaisuujsia ominaisuukxia ominaisuukska ominaisuuksiz minaisuuksia omnasuuksa omnaisuuksia ominisuuksi ominisuuksia ominasuuksia ominaisksia ominaisuuksa mnsks; 13754412670460; Nesteiden ja kaasujen ominaisuuksia; document
newtonin binomikaava nnewtonin newtoninn newtonin mewtonin nrwtonin neetonin newyonin newtpnin newtomin newtonon newtonim bewtonin ndwtonin nestonin newgonin newtlnin newtobin newtonkn newtonib nwtonin newtnin newtonn nwtnn binomikava bbinomikaava binomikaavaa ninomikaava bonomikaava bimomikaava binpmikaava binonikaava binomokaava binomilaava binomiksava binomikasva binomikaaba binomikaavs vinomikaava bknomikaava bibomikaava binlmikaava binokikaava binomkkaava binomijaava binomikzava binomikazva binomikaaca binomikaavz bnomkaava bnomikaava binmikaava binomkaava binomikv bnmkv; 13730071818889; Newtonin binomikaava; document
normaalijakauma normalijakauma nnormaalijakauma normaalijakaumaa mormaalijakauma nprmaalijakauma notmaalijakauma nornaalijakauma normsalijakauma normaslijakauma normaaöijakauma normaalojakauma normaalikakauma normaalijskauma normaalijalauma normaalijaksuma normaalijakaima normaalijakauna normaalijakaums bormaalijakauma nlrmaalijakauma nofmaalijakauma norkaalijakauma normzalijakauma normazlijakauma normaa:ijakauma normaalkjakauma normaalimakauma normaalijzkauma normaalijajauma normaalijakzuma normaalijakajma normaalijakauka normaalijakaumz nrmaalijakauma normlijkum normaaljakauma normaalijkauma normaalijakuma normaalijakama nrmljkm; 15675905478952; Normaalijakauma; document
normaalijakauman kertymäfunktio normalijakauman nnormaalijakauman normaalijakaumann mormaalijakauman nprmaalijakauman notmaalijakauman nornaalijakauman normsalijakauman normaslijakauman normaaöijakauman normaalojakauman normaalikakauman normaalijskauman normaalijalauman normaalijaksuman normaalijakaiman normaalijakaunan normaalijakaumsn normaalijakaumam bormaalijakauman nlrmaalijakauman nofmaalijakauman norkaalijakauman normzalijakauman normazlijakauman normaa:ijakauman normaalkjakauman normaalimakauman normaalijzkauman normaalijajauman normaalijakzuman normaalijakajman normaalijakaukan normaalijakaumzn normaalijakaumab nrmaalijakauman normlijkumn normaaljakauman normaalijkauman normaalijakuman normaalijakaman normaalijakaumn nrmljkmn kkertymäfunktio kertymäfunktioo kertymäfunktio lertymäfunktio krrtymäfunktio kettymäfunktio keryymäfunktio kertumäfunktio kertynäfunktio kertym'funktio kertymägunktio kertymäfinktio kertymäfumktio kertymäfunltio kertymäfunkyio kertymäfunktoo kertymäfunktip jertymäfunktio kdrtymäfunktio keftymäfunktio kergymäfunktio kerthmäfunktio kertykäfunktio kertymöfunktio kertymävunktio kertymäfjnktio kertymäfubktio kertymäfunjtio kertymäfunkgio kertymäfunktko kertymäfunktil krtymäfunktio kertmäfunktio kertymfunktio kertymäfnktio kertymäfunkto kertymäfunkti krtmfnkt; 13730073658802; Normaalijakauman kertymäfunktio; document
normaalijakauman tiheysfunktio normalijakauman nnormaalijakauman normaalijakaumann mormaalijakauman nprmaalijakauman notmaalijakauman nornaalijakauman normsalijakauman normaslijakauman normaaöijakauman normaalojakauman normaalikakauman normaalijskauman normaalijalauman normaalijaksuman normaalijakaiman normaalijakaunan normaalijakaumsn normaalijakaumam bormaalijakauman nlrmaalijakauman nofmaalijakauman norkaalijakauman normzalijakauman normazlijakauman normaa:ijakauman normaalkjakauman normaalimakauman normaalijzkauman normaalijajauman normaalijakzuman normaalijakajman normaalijakaukan normaalijakaumzn normaalijakaumab nrmaalijakauman normlijkumn normaaljakauman normaalijkauman normaalijakuman normaalijakaman normaalijakaumn nrmljkmn ttiheysfunktio tiheysfunktioo tiheysfunktio yiheysfunktio toheysfunktio tijeysfunktio tihrysfunktio tiheusfunktio tiheydfunktio tiheysgunktio tiheysfinktio tiheysfumktio tiheysfunltio tiheysfunkyio tiheysfunktoo tiheysfunktip giheysfunktio tkheysfunktio tineysfunktio tihdysfunktio tihehsfunktio tiheyxfunktio tiheysvunktio tiheysfjnktio tiheysfubktio tiheysfunjtio tiheysfunkgio tiheysfunktko tiheysfunktil theysfunkto theysfunktio tihysfunktio tihesfunktio tiheysfnktio tiheysfunkto tiheysfunkti thsfnkt; 13730071883440; Normaalijakauman tiheysfunktio; document
normaalipotentiaaleja normalipotentiaaleja normaalipotentialeja nnormaalipotentiaaleja normaalipotentiaalejaa normalipotentialeja mormaalipotentiaaleja nprmaalipotentiaaleja notmaalipotentiaaleja nornaalipotentiaaleja normsalipotentiaaleja normaslipotentiaaleja normaaöipotentiaaleja normaalopotentiaaleja normaaliåotentiaaleja normaalipptentiaaleja normaalipoyentiaaleja normaalipotrntiaaleja normaalipotemtiaaleja normaalipotenyiaaleja normaalipotentoaaleja normaalipotentisaleja normaalipotentiasleja normaalipotentiaaöeja normaalipotentiaalrja normaalipotentiaaleka normaalipotentiaalejs bormaalipotentiaaleja nlrmaalipotentiaaleja nofmaalipotentiaaleja norkaalipotentiaaleja normzalipotentiaaleja normazlipotentiaaleja normaa:ipotentiaaleja normaalkpotentiaaleja normaaliöotentiaaleja normaalipltentiaaleja normaalipogentiaaleja normaalipotdntiaaleja normaalipotebtiaaleja normaalipotengiaaleja normaalipotentkaaleja normaalipotentizaleja normaalipotentiazleja normaalipotentiaa:eja normaalipotentiaaldja normaalipotentiaalema normaalipotentiaalejz nrmaaliptentiaaleja nrmaalipotentiaaleja normlipotentilej normaalpotentaaleja normaalpotentiaaleja normaaliptentiaaleja normaalipotntiaalja normaalipotntiaaleja normaalipotentaaleja normaalipotentiaalja nrmlptntlj; 13754466560777; Normaalipotentiaaleja; document
nukleonit nnukleonit nukleonitt nukleonit mukleonit nikleonit nulleonit nuköeonit nuklronit nuklepnit nukleomit nukleonot nukleoniy bukleonit njkleonit nujleonit nuk:eonit nukldonit nuklelnit nukleobit nukleonkt nukleonig nkleonit nuklonit nuklenit nukleont nklnt; 15687226549514; Nukleonit; document
numeerinen derivointi numerinen nnumeerinen numeerinenn mumeerinen nimeerinen nuneerinen numrerinen numerrinen numeetinen numeeronen numeerimen numeerinrn numeerinem bumeerinen njmeerinen nukeerinen numderinen numedrinen numeefinen numeerknen numeeriben numeerindn numeerineb nmeerinen numrinn numeernen numeerinn nmrnn dderivointi derivointii derivointi ferivointi drrivointi detivointi derovointi deribointi derivpinti derivoonti derivoimti derivoinyi derivointo cerivointi ddrivointi defivointi derkvointi dericointi derivlinti derivoknti derivoibti derivoingi derivointk drivointi dervont dervointi derivinti derivonti drvnt; 13730069112094; Numeerinen derivointi; document
numeerinen integrointi numerinen nnumeerinen numeerinenn mumeerinen nimeerinen nuneerinen numrerinen numerrinen numeetinen numeeronen numeerimen numeerinrn numeerinem bumeerinen njmeerinen nukeerinen numderinen numedrinen numeefinen numeerknen numeeriben numeerindn numeerineb nmeerinen numrinn numeernen numeerinn nmrnn iintegrointi integrointii integrointi ontegrointi imtegrointi inyegrointi intrgrointi intehrointi integtointi integrpinti integroonti integroimti integroinyi integrointo kntegrointi ibtegrointi ingegrointi intdgrointi intebrointi integfointi integrlinti integroknti integroibti integroingi integrointk ntegront ntegrointi intgrointi integrinti integronti ntgrnt; 13730069131142; Numeerinen integrointi; document
näkyvän valon spektri ilmassa nnäkyvän näkyvänn näkyvän mäkyvän n'kyvän nälyvän näkuvän näkybän näkyv'n näkyväm bäkyvän nökyvän näjyvän näkhvän näkycän näkyvön näkyväb nkyvn nkyvän näkvän näkyvn nkvn vvalon valonn valon balon vslon vaöon valpn valom calon vzlon va:on valln valob vlon valn vln sspektri spektrii spektri dpektri såektri sprktri speltri spekyri spektti spektro xpektri söektri spdktri spejtri spekgri spektfi spektrk spktri spektr spktr ilmasa iilmassa ilmassaa olmassa iömassa ilnassa ilmsssa ilmadsa ilmasda ilmasss klmassa i:massa ilkassa ilmzssa ilmaxsa ilmasxa ilmassz lmassa ilmss ilmssa lmss; 13754439211007; Näkyvän valon spektri ilmassa; document
olosuhdemääritelmiä olosuhdemäritelmiä oolosuhdemääritelmiä olosuhdemääritelmiää plosuhdemääritelmiä oöosuhdemääritelmiä olpsuhdemääritelmiä oloduhdemääritelmiä olosihdemääritelmiä olosujdemääritelmiä olosuhfemääritelmiä olosuhdrmääritelmiä olosuhdenääritelmiä olosuhdem'äritelmiä olosuhdemä'ritelmiä olosuhdemäätitelmiä olosuhdemäärotelmiä olosuhdemääriyelmiä olosuhdemääritrlmiä olosuhdemääriteömiä olosuhdemääritelniä olosuhdemääritelmoä olosuhdemääritelmi' llosuhdemääritelmiä o:osuhdemääritelmiä ollsuhdemääritelmiä oloxuhdemääritelmiä olosjhdemääritelmiä olosundemääritelmiä olosuhcemääritelmiä olosuhddmääritelmiä olosuhdekääritelmiä olosuhdemöäritelmiä olosuhdemäöritelmiä olosuhdemääfitelmiä olosuhdemäärktelmiä olosuhdemäärigelmiä olosuhdemääritdlmiä olosuhdemäärite:miä olosuhdemääritelkiä olosuhdemääritelmkä olosuhdemääritelmiö lsuhdemääritelmiä losuhdemääritelmiä olsuhdemääritelmiä oloshdemääritelmiä olosuhdmääritlmiä olosuhdmääritelmiä olosuhdemritelmi olosuhdemäärtelmä olosuhdemäärtelmiä olosuhdemääritlmiä olosuhdemääritelmä lshdmrtlm; 14494917445737; Olosuhdemääritelmiä; document
osa metallien jännitesarjaa oosa osaa osa psa oda oss lsa oxa osz sa os s metalien mmetallien metallienn netallien mrtallien meyallien metsllien metaölien metalöien metalloen metallirn metalliem ketallien mdtallien megallien metzllien meta:lien metal:ien metallken metallidn metallieb mtallin mtallien metllien metallen metallin mtlln jänitesarjaa jännitesarja jjännitesarjaa jännitesarjaaa jänitesarja kännitesarjaa j'nnitesarjaa jämnitesarjaa jänmitesarjaa jännotesarjaa jänniyesarjaa jännitrsarjaa jännitedarjaa jännitessrjaa jännitesatjaa jännitesarkaa jännitesarjsa jännitesarjas männitesarjaa jönnitesarjaa jäbnitesarjaa jänbitesarjaa jännktesarjaa jännigesarjaa jännitdsarjaa jännitexarjaa jänniteszrjaa jännitesafjaa jännitesarmaa jännitesarjza jännitesarjaz jnnitesarjaa jänntesarjaa jännitsarjaa jännitesrj jännitesrjaa jnntsrj; 13754466575430; Osa metallien jännitesarjaa; document
palautuskaavat palautuskavat ppalautuskaavat palautuskaavatt åalautuskaavat pslautuskaavat paöautuskaavat palsutuskaavat palaituskaavat palauyuskaavat palautiskaavat palautudkaavat palautuslaavat palautusksavat palautuskasvat palautuskaabat palautuskaavst palautuskaavay öalautuskaavat pzlautuskaavat pa:autuskaavat palzutuskaavat palajtuskaavat palauguskaavat palautjskaavat palautuxkaavat palautusjaavat palautuskzavat palautuskazvat palautuskaacat palautuskaavzt palautuskaavag plutuskvt plautuskaavat palutuskaavat palatskaavat palatuskaavat palautskaavat palautuskaavt pltskvt; 13730058390407; Palautuskaavat; document
paraabeli parabeli pparaabeli paraabelii åaraabeli psraabeli pataabeli parsabeli parasbeli paraaneli paraabrli paraabeöi paraabelo öaraabeli pzraabeli pafaabeli parzabeli parazbeli paraaveli paraabdli paraabe:i paraabelk prbeli praabeli paraabli paraabel prbl; 13730064853588; Paraabeli; document
peruskaavat peruskavat pperuskaavat peruskaavatt åeruskaavat prruskaavat petuskaavat periskaavat perudkaavat peruslaavat perusksavat peruskasvat peruskaabat peruskaavst peruskaavay öeruskaavat pdruskaavat pefuskaavat perjskaavat peruxkaavat perusjaavat peruskzavat peruskazvat peruskaacat peruskaavzt peruskaavag pruskaavat perskaavat peruskvt peruskaavt prskvt; 13730058350956; Peruskaavat; document
perustyövälineitä pperustyövälineitä perustyövälineitää perustyövälineitä åerustyövälineitä prrustyövälineitä petustyövälineitä peristyövälineitä perudtyövälineitä perusyyövälineitä perustuövälineitä perustyävälineitä perustyöbälineitä perustyöv'lineitä perustyöväöineitä perustyöväloneitä perustyövälimeitä perustyövälinritä perustyövälineotä perustyövälineiyä perustyövälineit' öerustyövälineitä pdrustyövälineitä pefustyövälineitä perjstyövälineitä peruxtyövälineitä perusgyövälineitä perusthövälineitä perusty-välineitä perustyöcälineitä perustyövölineitä perustyövä:ineitä perustyövälkneitä perustyövälibeitä perustyövälinditä perustyövälinektä perustyövälineigä perustyövälineitö prustyövälinitä prustyövälineitä perstyövälineitä perustövälineitä perustyvälineitä perustyövlineit perustyövlineitä perustyövälnetä perustyövälneitä perustyövälinitä perustyövälinetä prstvlnt; 13754489172306; Perustyövälineitä; document
perusyhtälöitä pperusyhtälöitä perusyhtälöitää perusyhtälöitä åerusyhtälöitä prrusyhtälöitä petusyhtälöitä perisyhtälöitä perudyhtälöitä perusuhtälöitä perusyjtälöitä perusyhyälöitä perusyht'löitä perusyhtäööitä perusyhtäläitä perusyhtälöotä perusyhtälöiyä perusyhtälöit' öerusyhtälöitä pdrusyhtälöitä pefusyhtälöitä perjsyhtälöitä peruxyhtälöitä perushhtälöitä perusyntälöitä perusyhgälöitä perusyhtölöitä perusyhtä:öitä perusyhtäl-itä perusyhtälöktä perusyhtälöigä perusyhtälöitö prusyhtälöitä persyhtälöitä perushtälöitä perusyhtlöit perusyhtlöitä perusyhtälitä perusyhtälötä prshtlt; 13730059724567; Perusyhtälöitä; document
perusyksiköiden määritelmät pperusyksiköiden perusyksiköidenn perusyksiköiden åerusyksiköiden prrusyksiköiden petusyksiköiden perisyksiköiden perudyksiköiden perusuksiköiden perusylsiköiden perusykdiköiden perusyksoköiden perusyksilöiden perusyksikäiden perusyksiköoden perusyksiköifen perusyksiköidrn perusyksiköidem öerusyksiköiden pdrusyksiköiden pefusyksiköiden perjsyksiköiden peruxyksiköiden perushksiköiden perusyjsiköiden perusykxiköiden perusykskköiden perusyksijöiden perusyksik-iden perusyksikökden perusyksiköicen perusyksiköiddn perusyksiköideb prusyksiköidn prusyksiköiden persyksiköiden perusksiköiden perusyksköden perusyksköiden perusyksikiden perusyksiköden perusyksiköidn prskskdn märitelmät mmääritelmät määritelmätt nääritelmät m'äritelmät mä'ritelmät määtitelmät määrotelmät määriyelmät määritrlmät määriteömät määritelnät määritelm't määritelmäy kääritelmät möäritelmät mäöritelmät määfitelmät määrktelmät määrigelmät määritdlmät määrite:mät määritelkät määritelmöt määritelmäg mritelmt määrtelmät määritlmät määritelmt mrtlmt; 13754406978503; Perusyksiköiden määritelmät; document
ph-indikaattoreita ph-indikattoreita ph-indikaatoreita pph-indikaattoreita ph-indikaattoreitaa ph-indikatoreita åh-indikaattoreita pj-indikaattoreita ph-ondikaattoreita ph-imdikaattoreita ph-infikaattoreita ph-indokaattoreita ph-indilaattoreita ph-indiksattoreita ph-indikasttoreita ph-indikaaytoreita ph-indikaatyoreita ph-indikaattpreita ph-indikaattoteita ph-indikaattorrita ph-indikaattoreota ph-indikaattoreiya ph-indikaattoreits öh-indikaattoreita pn-indikaattoreita ph-kndikaattoreita ph-ibdikaattoreita ph-incikaattoreita ph-indkkaattoreita ph-indijaattoreita ph-indikzattoreita ph-indikazttoreita ph-indikaagtoreita ph-indikaatgoreita ph-indikaattlreita ph-indikaattofeita ph-indikaattordita ph-indikaattorekta ph-indikaattoreiga ph-indikaattoreitz ph-ndkaattoreta ph-ndikaattoreita ph-indkaattoreita ph-indikttoreit ph-indikaattreita ph-indikaattorita ph-indikaattoreta ph-ndkttrt; 13754487720230; pH-indikaattoreita; document
