aaltoliike- ja valo-oppi altoliike- aaltolike- aaaltoliike- aaltoliike-- altolike- saltoliike- asltoliike- aaötoliike- aalyoliike- aaltpliike- aaltoöiike- aaltoloike- aaltolioke- aaltoliile- aaltoliikr- zaltoliike- azltoliike- aa:toliike- aalgoliike- aaltlliike- aalto:iike- aaltolkike- aaltolikke- aaltoliije- aaltoliikd- ltoliike- aaltliike- aaltolke- aaltoliik- ltlk- jja jaa ja ka js ma jz j valo-opi vvalo-oppi valo-oppii balo-oppi vslo-oppi vaöo-oppi valp-oppi valo-pppi valo-oåpi valo-opåi valo-oppo calo-oppi vzlo-oppi va:o-oppi vall-oppi valo-lppi valo-oöpi valo-opöi valo-oppk vlo-oppi val-ppi val-oppi valo-ppi valo-opp vl-pp; 13730008454721; Aaltoliike- ja valo-oppi; category
alkuaineet alkuainet aalkuaineet alkuaineett slkuaineet aökuaineet alluaineet alkiaineet alkusineet alkuaoneet alkuaimeet alkuainret alkuainert alkuaineey zlkuaineet a:kuaineet aljuaineet alkjaineet alkuzineet alkuakneet alkuaibeet alkuaindet alkuainedt alkuaineeg lkuineet lkuaineet alkaineet alkuineet alkuaneet alkuaint lknt; 13730011112826; Alkuaineet; category
analyyttinen geometria analyttinen analyytinen aanalyyttinen analyyttinenn analytinen snalyyttinen amalyyttinen anslyyttinen anaöyyttinen analuyttinen analyuttinen analyyytinen analyytyinen analyyttonen analyyttimen analyyttinrn analyyttinem znalyyttinen abalyyttinen anzlyyttinen ana:yyttinen analhyttinen analyhttinen analyygtinen analyytginen analyyttknen analyyttiben analyyttindn analyyttineb nlyyttinen nalyyttinen anlyyttinen analttinen analyyttnen analyyttinn nlttnn ggeometria geometriaa geometria heometria grometria gepmetria geonetria geomrtria geomeyria geomettia geometroa geometris beometria gdometria gelmetria geoketria geomdtria geomegria geometfia geometrka geometriz gomtria gometria gemetria geomtria geometra geometri gmtr; 13730006241057; Analyyttinen geometria; category
aritmetiikka ja algebra aritmetikka aritmetiika aaritmetiikka aritmetiikkaa aritmetika sritmetiikka atitmetiikka arotmetiikka ariymetiikka aritnetiikka aritmrtiikka aritmeyiikka aritmetoikka aritmetiokka aritmetiilka aritmetiikla aritmetiikks zritmetiikka afitmetiikka arktmetiikka arigmetiikka aritketiikka aritmdtiikka aritmegiikka aritmetkikka aritmetikkka aritmetiijka aritmetiikja aritmetiikkz ritmetiikk ritmetiikka artmetkka artmetiikka aritmtiikka rtmtkk jja jaa ja ka js ma jz j aalgebra algebraa algebra slgebra aögebra alhebra algrbra algenra algebta algebrs zlgebra a:gebra albebra algdbra algevra algebfa algebrz lgebr lgebra algbra lgbr; 13730005557989; Aritmetiikka ja algebra; category
atomi- ja ydinfysiikka aatomi- atomi-- atomi- stomi- ayomi- atpmi- atoni- atomo- ztomi- agomi- atlmi- atoki- atomk- tomi- atmi- atom- tm- jja jaa ja ka js ma jz j ydinfysikka ydinfysiika yydinfysiikka ydinfysiikkaa ydinfysika udinfysiikka yfinfysiikka ydonfysiikka ydimfysiikka ydingysiikka ydinfusiikka ydinfydiikka ydinfysoikka ydinfysiokka ydinfysiilka ydinfysiikla ydinfysiikks hdinfysiikka ycinfysiikka ydknfysiikka ydibfysiikka ydinvysiikka ydinfhsiikka ydinfyxiikka ydinfyskikka ydinfysikkka ydinfysiijka ydinfysiikja ydinfysiikkz dinfsiikka dinfysiikka ydnfyskka ydnfysiikka ydinfsiikka ydinfysiikk dnfskk; 13730008493925; Atomi- ja ydinfysiikka; category
differentiaalilaskenta diferentiaalilaskenta differentialilaskenta ddifferentiaalilaskenta differentiaalilaskentaa diferentialilaskenta fifferentiaalilaskenta dofferentiaalilaskenta digferentiaalilaskenta difgerentiaalilaskenta diffrrentiaalilaskenta diffetentiaalilaskenta differrntiaalilaskenta differemtiaalilaskenta differenyiaalilaskenta differentoaalilaskenta differentisalilaskenta differentiaslilaskenta differentiaaöilaskenta differentiaalolaskenta differentiaaliöaskenta differentiaalilsskenta differentiaaliladkenta differentiaalilaslenta differentiaalilaskrnta differentiaalilaskemta differentiaalilaskenya differentiaalilaskents cifferentiaalilaskenta dkfferentiaalilaskenta divferentiaalilaskenta difverentiaalilaskenta diffdrentiaalilaskenta diffefentiaalilaskenta differdntiaalilaskenta differebtiaalilaskenta differengiaalilaskenta differentkaalilaskenta differentizalilaskenta differentiazlilaskenta differentiaa:ilaskenta differentiaalklaskenta differentiaali:askenta differentiaalilzskenta differentiaalilaxkenta differentiaalilasjenta differentiaalilaskdnta differentiaalilaskebta differentiaalilaskenga differentiaalilaskentz dfferentaallaskenta dfferentiaalilaskenta diffrntiaalilasknta diffrentiaalilaskenta differntiaalilaskenta differentaalilaskenta differentililskent differentiaallaskenta differentiaalilskenta differentiaalilasknta dffrntllsknt; 13730006258195; Differentiaalilaskenta; category
fysiikka fysikka fysiika ffysiikka fysiikkaa fysika gysiikka fusiikka fydiikka fysoikka fysiokka fysiilka fysiikla fysiikks vysiikka fhsiikka fyxiikka fyskikka fysikkka fysiijka fysiikja fysiikkz fsiikka fyskka fysiikk fskk; 13730004029344; Fysiikka; category
geometria ggeometria geometriaa geometria heometria grometria gepmetria geonetria geomrtria geomeyria geomettia geometroa geometris beometria gdometria gelmetria geoketria geomdtria geomegria geometfia geometrka geometriz gomtria gometria gemetria geomtria geometra geometri gmtr; 13730005949324; Geometria; category
hapot, emäkset, ph hhapot, hapot,, hapot, japot, hspot, haåot, happt, hapoy, napot, hzpot, haöot, haplt, hapog, hpot, hapt, hpt, eemäkset, emäkset,, emäkset, rmäkset, enäkset, em'kset, emälset, emäkdet, emäksrt, emäksey, dmäkset, ekäkset, emökset, emäjset, emäkxet, emäksdt, emäkseg, mäkst, mäkset, emkset, emäkst, mkst, pph phh ph åh pj öh pn; 13730011195410; Hapot, emäkset, pH; category
hiilen yhdisteitä hilen hhiilen hiilenn jiilen hoilen hiolen hiiöen hiilrn hiilem niilen hkilen hiklen hii:en hiildn hiileb hlen hiiln hln yyhdisteitä yhdisteitää yhdisteitä uhdisteitä yjdisteitä yhfisteitä yhdosteitä yhdidteitä yhdisyeitä yhdistritä yhdisteotä yhdisteiyä yhdisteit' hhdisteitä yndisteitä yhcisteitä yhdksteitä yhdixteitä yhdisgeitä yhdistditä yhdistektä yhdisteigä yhdisteitö hdisteitä yhdstetä yhdsteitä yhdistitä yhdistetä yhdisteit hdstt; 13730011213310; Hiilen yhdisteitä; category
integraalilaskenta integralilaskenta iintegraalilaskenta integraalilaskentaa ontegraalilaskenta imtegraalilaskenta inyegraalilaskenta intrgraalilaskenta intehraalilaskenta integtaalilaskenta integrsalilaskenta integraslilaskenta integraaöilaskenta integraalolaskenta integraaliöaskenta integraalilsskenta integraaliladkenta integraalilaslenta integraalilaskrnta integraalilaskemta integraalilaskenya integraalilaskents kntegraalilaskenta ibtegraalilaskenta ingegraalilaskenta intdgraalilaskenta intebraalilaskenta integfaalilaskenta integrzalilaskenta integrazlilaskenta integraa:ilaskenta integraalklaskenta integraali:askenta integraalilzskenta integraalilaxkenta integraalilasjenta integraalilaskdnta integraalilaskebta integraalilaskenga integraalilaskentz ntegraallaskenta ntegraalilaskenta intgraalilasknta intgraalilaskenta integrlilskent integraallaskenta integraalilskenta integraalilasknta ntgrllsknt; 13730006359540; Integraalilaskenta; category
jaksollinen järjestelmä jaksolinen jjaksollinen jaksollinenn kaksollinen jsksollinen jalsollinen jakdollinen jakspllinen jaksoölinen jaksolöinen jaksollonen jaksollimen jaksollinrn jaksollinem maksollinen jzksollinen jajsollinen jakxollinen jakslllinen jakso:linen jaksol:inen jaksollknen jaksolliben jaksollindn jaksollineb jksollinen jaksllinen jaksollnen jaksollinn jksllnn jjärjestelmä järjestelmää järjestelmä kärjestelmä j'rjestelmä jätjestelmä järkestelmä järjrstelmä järjedtelmä järjesyelmä järjestrlmä järjesteömä järjestelnä järjestelm' märjestelmä jörjestelmä jäfjestelmä järmestelmä järjdstelmä järjextelmä järjesgelmä järjestdlmä järjeste:mä järjestelkä järjestelmö jrjestelm jrjestelmä järjstlmä järjstelmä järjestlmä jrjstlm; 13810010460918; Jaksollinen järjestelmä; category
kaavoja kavoja kkaavoja kaavojaa laavoja ksavoja kasvoja kaaboja kaavpja kaavoka kaavojs jaavoja kzavoja kazvoja kaacoja kaavlja kaavoma kaavojz kvoj kaavja kvj; 13730008525538; Kaavoja; category
kemia kkemia kemiaa kemia lemia krmia kenia kemoa kemis jemia kdmia kekia kemka kemiz kmia kema kemi km; 13730004134879; Kemia; category
kokeellinen työskentely kokellinen kokeelinen kkokeellinen kokeellinenn kokelinen lokeellinen kpkeellinen koleellinen kokrellinen kokerllinen kokeeölinen kokeelöinen kokeellonen kokeellimen kokeellinrn kokeellinem jokeellinen klkeellinen kojeellinen kokdellinen kokedllinen kokee:linen kokeel:inen kokeellknen kokeelliben kokeellindn kokeellineb kkeellinen kokllinn kokeellnen kokeellinn kkllnn ttyöskentely työskentelyy työskentely yyöskentely tuöskentely tyäskentely työdkentely työslentely työskrntely työskemtely työskenyely työskentrly työskenteöy työskentelu gyöskentely thöskentely ty-skentely työxkentely työsjentely työskdntely työskebtely työskengely työskentdly työskente:y työskentelh töskentel töskentely tyskentely työskntly työskntely työskently tskntl; 15819176661153; Kokeellinen työskentely; category
logiikka ja lukuteoria logikka logiika llogiikka logiikkaa logika öogiikka lpgiikka lohiikka logoikka logiokka logiilka logiikla logiikks :ogiikka llgiikka lobiikka logkikka logikkka logiijka logiikja logiikkz lgiikka logkka logiikk lgkk jja jaa ja ka js ma jz j llukuteoria lukuteoriaa lukuteoria öukuteoria likuteoria luluteoria lukiteoria lukuyeoria lukutroria lukutepria lukuteotia lukuteoroa lukuteoris :ukuteoria ljkuteoria lujuteoria lukjteoria lukugeoria lukutdoria lukutelria lukuteofia lukuteorka lukuteoriz lkteoria lkuteoria lukteoria lukutoria lukuteria lukuteora lukuteori lktr; 13730006384746; Logiikka ja lukuteoria; category
matematiikka matematikka matematiika mmatematiikka matematiikkaa matematika natematiikka mstematiikka mayematiikka matrmatiikka matenatiikka matemstiikka matemayiikka matematoikka matematiokka matematiilka matematiikla matematiikks katematiikka mztematiikka magematiikka matdmatiikka matekatiikka matemztiikka matemagiikka matematkikka matematikkka matematiijka matematiikja matematiikkz mtemtiikk mtematiikka matmatiikka matemtiikka matematkka mtmtkk; 13730001018472; Matematiikka; category
mekaniikka ja termodynamiikka mekanikka mekaniika mmekaniikka mekaniikkaa mekanika nekaniikka mrkaniikka melaniikka meksniikka mekamiikka mekanoikka mekaniokka mekaniilka mekaniikla mekaniikks kekaniikka mdkaniikka mejaniikka mekzniikka mekabiikka mekankikka mekanikkka mekaniijka mekaniikja mekaniikkz mkaniikka mekniikk mekniikka mekankka mknkk jja jaa ja ka js ma jz j termodynamikka termodynamiika ttermodynamiikka termodynamiikkaa termodynamika yermodynamiikka trrmodynamiikka tetmodynamiikka ternodynamiikka termpdynamiikka termofynamiikka termodunamiikka termodymamiikka termodynsmiikka termodynaniikka termodynamoikka termodynamiokka termodynamiilka termodynamiikla termodynamiikks germodynamiikka tdrmodynamiikka tefmodynamiikka terkodynamiikka termldynamiikka termocynamiikka termodhnamiikka termodybamiikka termodynzmiikka termodynakiikka termodynamkikka termodynamikkka termodynamiijka termodynamiikja termodynamiikkz trmodynamiikka termdynamiikka termodnamiikka termodynmiikk termodynmiikka termodynamkka trmdnmkk; 13730008435335; Mekaniikka ja termodynamiikka; category
merkintöjä ja kaavoja mmerkintöjä merkintöjää merkintöjä nerkintöjä mrrkintöjä metkintöjä merlintöjä merkontöjä merkimtöjä merkinyöjä merkintäjä merkintökä merkintöj' kerkintöjä mdrkintöjä mefkintöjä merjintöjä merkkntöjä merkibtöjä merkingöjä merkint-jä merkintömä merkintöjö mrkintöjä merkntöjä merkintjä merkintöj mrkntj jja jaa ja ka js ma jz j kavoja kkaavoja kaavojaa laavoja ksavoja kasvoja kaaboja kaavpja kaavoka kaavojs jaavoja kzavoja kazvoja kaacoja kaavlja kaavoma kaavojz kvoj kaavja kvj; 13730011088350; Merkintöjä ja kaavoja; category
merkintöjä ja symboleja mmerkintöjä merkintöjää merkintöjä nerkintöjä mrrkintöjä metkintöjä merlintöjä merkontöjä merkimtöjä merkinyöjä merkintäjä merkintökä merkintöj' kerkintöjä mdrkintöjä mefkintöjä merjintöjä merkkntöjä merkibtöjä merkingöjä merkint-jä merkintömä merkintöjö mrkintöjä merkntöjä merkintjä merkintöj mrkntj jja jaa ja ka js ma jz j ssymboleja symbolejaa symboleja dymboleja sumboleja synboleja symnoleja symbpleja symboöeja symbolrja symboleka symbolejs xymboleja shmboleja sykboleja symvoleja symblleja symbo:eja symboldja symbolema symbolejz smboleja symbleja symbolja symbolej smblj; 13730003960583; Merkintöjä ja symboleja; category
numeerisia menetelmiä numerisia nnumeerisia numeerisiaa mumeerisia nimeerisia nuneerisia numrerisia numerrisia numeetisia numeerosia numeeridia numeerisoa numeerisis bumeerisia njmeerisia nukeerisia numderisia numedrisia numeefisia numeerksia numeerixia numeeriska numeerisiz nmeerisia numrisia numeersa numeersia numeerisa numeerisi nmrs mmenetelmiä menetelmiää menetelmiä nenetelmiä mrnetelmiä memetelmiä menrtelmiä meneyelmiä menetrlmiä meneteömiä menetelniä menetelmoä menetelmi' kenetelmiä mdnetelmiä mebetelmiä mendtelmiä menegelmiä menetdlmiä menete:miä menetelkiä menetelmkä menetelmiö mntlmiä mnetelmiä mentelmiä menetlmiä menetelmä menetelmi mntlm; 13730006372764; Numeerisia menetelmiä; category
numeerisia taulukoita numerisia nnumeerisia numeerisiaa mumeerisia nimeerisia nuneerisia numrerisia numerrisia numeetisia numeerosia numeeridia numeerisoa numeerisis bumeerisia njmeerisia nukeerisia numderisia numedrisia numeefisia numeerksia numeerixia numeeriska numeerisiz nmeerisia numrisia numeersa numeersia numeerisa numeerisi nmrs ttaulukoita taulukoitaa taulukoita yaulukoita tsulukoita tailukoita tauöukoita taulikoita taululoita taulukpita taulukoota taulukoiya taulukoits gaulukoita tzulukoita tajlukoita tau:ukoita tauljkoita taulujoita tauluklita taulukokta taulukoiga taulukoitz tulukoit tulukoita talkoita talukoita taulkoita taulukita taulukota tlkt; 13730070624937; Numeerisia taulukoita; category
suureita ja yksiköitä sureita ssuureita suureitaa duureita siureita suireita suuteita suurrita suureota suureiya suureits xuureita sjureita sujreita suufeita suurdita suurekta suureiga suureitz sreita suurita suureta suureit srt jja jaa ja ka js ma jz j yyksiköitä yksiköitää yksiköitä uksiköitä ylsiköitä ykdiköitä yksoköitä yksilöitä yksikäitä yksiköotä yksiköiyä yksiköit' hksiköitä yjsiköitä ykxiköitä ykskköitä yksijöitä yksik-itä yksiköktä yksiköigä yksiköitö ksiköitä ykskötä yksköitä yksikitä yksikötä yksiköit kskt; 13730008315580; Suureita ja yksiköitä; category
sähkö- ja magnetismioppi ssähkö- sähkö-- sähkö- dähkö- s'hkö- säjkö- sählö- sähkä- xähkö- söhkö- sänkö- sähjö- sähk-- shkö- sähk- shk- jja jaa ja ka js ma jz j magnetismiopi mmagnetismioppi magnetismioppii nagnetismioppi msgnetismioppi mahnetismioppi magmetismioppi magnrtismioppi magneyismioppi magnetosmioppi magnetidmioppi magnetisnioppi magnetismooppi magnetismipppi magnetismioåpi magnetismiopåi magnetismioppo kagnetismioppi mzgnetismioppi mabnetismioppi magbetismioppi magndtismioppi magnegismioppi magnetksmioppi magnetixmioppi magnetiskioppi magnetismkoppi magnetismilppi magnetismioöpi magnetismiopöi magnetismioppk mgnetismioppi magntismioppi magnetsmopp magnetsmioppi magnetismoppi magnetismippi mgntsmpp; 13730008477929; Sähkö- ja magnetismioppi; category
taulukoita ttaulukoita taulukoitaa taulukoita yaulukoita tsulukoita tailukoita tauöukoita taulikoita taululoita taulukpita taulukoota taulukoiya taulukoits gaulukoita tzulukoita tajlukoita tau:ukoita tauljkoita taulujoita tauluklita taulukokta taulukoiga taulukoitz tulukoit tulukoita talkoita talukoita taulkoita taulukita taulukota tlkt; 13730008414038; Taulukoita; category
todennäköisyyslaskenta ja tilastotiede todenäköisyyslaskenta todennäköisyslaskenta ttodennäköisyyslaskenta todennäköisyyslaskentaa todenäköisyslaskenta yodennäköisyyslaskenta tpdennäköisyyslaskenta tofennäköisyyslaskenta todrnnäköisyyslaskenta todemnäköisyyslaskenta todenmäköisyyslaskenta todenn'köisyyslaskenta todennälöisyyslaskenta todennäkäisyyslaskenta todennäköosyyslaskenta todennäköidyyslaskenta todennäköisuyslaskenta todennäköisyuslaskenta todennäköisyydlaskenta todennäköisyysöaskenta todennäköisyyslsskenta todennäköisyysladkenta todennäköisyyslaslenta todennäköisyyslaskrnta todennäköisyyslaskemta todennäköisyyslaskenya todennäköisyyslaskents godennäköisyyslaskenta tldennäköisyyslaskenta tocennäköisyyslaskenta toddnnäköisyyslaskenta todebnäköisyyslaskenta todenbäköisyyslaskenta todennököisyyslaskenta todennäjöisyyslaskenta todennäk-isyyslaskenta todennäköksyyslaskenta todennäköixyyslaskenta todennäköishyslaskenta todennäköisyhslaskenta todennäköisyyxlaskenta todennäköisyys:askenta todennäköisyyslzskenta todennäköisyyslaxkenta todennäköisyyslasjenta todennäköisyyslaskdnta todennäköisyyslaskebta todennäköisyyslaskenga todennäköisyyslaskentz tdennäköisyyslaskenta todnnäköisyyslasknta todnnäköisyyslaskenta todennköisyyslaskenta todennäkisyyslaskenta todennäkösyyslaskenta todennäköisslaskenta todennäköisyyslskent todennäköisyyslskenta todennäköisyyslasknta tdnnksslsknt jja jaa ja ka js ma jz j ttilastotiede tilastotiedee tilastotiede yilastotiede tolastotiede tiöastotiede tilsstotiede tiladtotiede tilasyotiede tilastptiede tilastoyiede tilastotoede tilastotirde tilastotiefe tilastotiedr gilastotiede tklastotiede ti:astotiede tilzstotiede tilaxtotiede tilasgotiede tilastltiede tilastogiede tilastotkede tilastotidde tilastotiece tilastotiedd tlastotede tlastotiede tilstotiede tilasttiede tilastotede tilastotid tilastotide tlsttd; 13730006397362; Todennäköisyyslaskenta ja tilastotiede; category
trigonometria ttrigonometria trigonometriaa trigonometria yrigonometria ttigonometria trogonometria trihonometria trigpnometria trigomometria trigonpmetria trigononetria trigonomrtria trigonomeyria trigonomettia trigonometroa trigonometris grigonometria tfigonometria trkgonometria tribonometria triglnometria trigobometria trigonlmetria trigonoketria trigonomdtria trigonomegria trigonometfia trigonometrka trigonometriz trgonometra trgonometria trignmetria trignometria trigonmetria trigonomtria trigonometra trigonometri trgnmtr; 13730006047578; Trigonometria; category
tähtitiede ttähtitiede tähtitiedee tähtitiede yähtitiede t'htitiede täjtitiede tähyitiede tähtotiede tähtiyiede tähtitoede tähtitirde tähtitiefe tähtitiedr gähtitiede töhtitiede täntitiede tähgitiede tähtktiede tähtigiede tähtitkede tähtitidde tähtitiece tähtitiedd thtitiede tähttede tähttiede tähtitede tähtitid tähtitide thttd; 13730008509211; Tähtitiede; category
vektorilaskenta vvektorilaskenta vektorilaskentaa vektorilaskenta bektorilaskenta vrktorilaskenta veltorilaskenta vekyorilaskenta vektprilaskenta vektotilaskenta vektorolaskenta vektoriöaskenta vektorilsskenta vektoriladkenta vektorilaslenta vektorilaskrnta vektorilaskemta vektorilaskenya vektorilaskents cektorilaskenta vdktorilaskenta vejtorilaskenta vekgorilaskenta vektlrilaskenta vektofilaskenta vektorklaskenta vektori:askenta vektorilzskenta vektorilaxkenta vektorilasjenta vektorilaskdnta vektorilaskebta vektorilaskenga vektorilaskentz vktorilasknta vktorilaskenta vektrilaskenta vektorlaskenta vektorilskent vektorilskenta vektorilasknta vktrlsknt; 13730006218432; Vektorilaskenta; category
yhdisteet yhdistet yyhdisteet yhdisteett uhdisteet yjdisteet yhfisteet yhdosteet yhdidteet yhdisyeet yhdistret yhdistert yhdisteey hhdisteet yndisteet yhcisteet yhdksteet yhdixteet yhdisgeet yhdistdet yhdistedt yhdisteeg hdisteet yhdsteet yhdistt hdstt; 13730011177618; Yhdisteet; category
aaltoliike- ja valo-oppi altoliike- aaltolike- aaaltoliike- aaltoliike-- altolike- saltoliike- asltoliike- aaötoliike- aalyoliike- aaltpliike- aaltoöiike- aaltoloike- aaltolioke- aaltoliile- aaltoliikr- zaltoliike- azltoliike- aa:toliike- aalgoliike- aaltlliike- aalto:iike- aaltolkike- aaltolikke- aaltoliije- aaltoliikd- ltoliike- aaltliike- aaltolke- aaltoliik- ltlk- jja jaa ja ka js ma jz j valo-opi vvalo-oppi valo-oppii balo-oppi vslo-oppi vaöo-oppi valp-oppi valo-pppi valo-oåpi valo-opåi valo-oppo calo-oppi vzlo-oppi va:o-oppi vall-oppi valo-lppi valo-oöpi valo-opöi valo-oppk vlo-oppi val-ppi val-oppi valo-ppi valo-opp vl-pp; 13754455866059; Aaltoliike- ja valo-oppi; document
absoluuttinen kulmayksikkö radiaani absoluttinen absoluutinen aabsoluuttinen absoluuttinenn absolutinen sbsoluuttinen ansoluuttinen abdoluuttinen abspluuttinen absoöuuttinen absoliuttinen absoluittinen absoluuytinen absoluutyinen absoluuttonen absoluuttimen absoluuttinrn absoluuttinem zbsoluuttinen avsoluuttinen abxoluuttinen abslluuttinen abso:uuttinen absoljuttinen absolujttinen absoluugtinen absoluutginen absoluuttknen absoluuttiben absoluuttindn absoluuttineb bsoluuttinen absluuttinen absolttinen absoluuttnen absoluuttinn bslttnn kulmayksikö kkulmayksikkö kulmayksikköö lulmayksikkö kilmayksikkö kuömayksikkö kulnayksikkö kulmsyksikkö kulmauksikkö kulmaylsikkö kulmaykdikkö kulmayksokkö kulmayksilkö kulmayksiklö kulmayksikkä julmayksikkö kjlmayksikkö ku:mayksikkö kulkayksikkö kulmzyksikkö kulmahksikkö kulmayjsikkö kulmaykxikkö kulmaykskkkö kulmayksijkö kulmayksikjö kulmayksikk- klmayksikkö kulmyksikkö kulmaksikkö kulmaykskkö kulmayksikk klmkskk radiani rradiaani radiaanii tadiaani rsdiaani rafiaani radoaani radisani radiasni radiaami radiaano fadiaani rzdiaani raciaani radkaani radizani radiazni radiaabi radiaank rdini rdiaani radaan radaani rdn; 13730058284290; Absoluuttinen kulmayksikkö radiaani; document
aineiden taitekertoimia aaineiden aineidenn aineiden sineiden aoneiden aimeiden ainriden aineoden aineifen aineidrn aineidem zineiden akneiden aibeiden aindiden ainekden aineicen aineiddn aineideb ineiden aneden aneiden ainidn ainiden aineden aineidn ndn ttaitekertoimia taitekertoimiaa taitekertoimia yaitekertoimia tsitekertoimia taotekertoimia taiyekertoimia taitrkertoimia taitelertoimia taitekrrtoimia taitekettoimia taitekeryoimia taitekertpimia taitekertoomia taitekertoinia taitekertoimoa taitekertoimis gaitekertoimia tzitekertoimia taktekertoimia taigekertoimia taitdkertoimia taitejertoimia taitekdrtoimia taitekeftoimia taitekergoimia taitekertlimia taitekertokmia taitekertoikia taitekertoimka taitekertoimiz titekertoimi titekertoimia tatekertoma tatekertoimia taitkrtoimia taitkertoimia taitekrtoimia taitekertimia taitekertomia taitekertoima ttkrtm; 13754439226679; Aineiden taitekertoimia; document
alkuaineiden isotooppeja aalkuaineiden alkuaineidenn alkuaineiden slkuaineiden aökuaineiden alluaineiden alkiaineiden alkusineiden alkuaoneiden alkuaimeiden alkuainriden alkuaineoden alkuaineifen alkuaineidrn alkuaineidem zlkuaineiden a:kuaineiden aljuaineiden alkjaineiden alkuzineiden alkuakneiden alkuaibeiden alkuaindiden alkuainekden alkuaineicen alkuaineiddn alkuaineideb lkuineiden lkuaineiden alkaineiden alkuineiden alkuaneden alkuaneiden alkuainidn alkuainiden alkuaineden alkuaineidn lkndn isotoppeja isotoopeja iisotooppeja isotooppejaa isotopeja osotooppeja idotooppeja isptooppeja isoyooppeja isotpoppeja isotopppeja isotooåpeja isotoopåeja isotoopprja isotooppeka isotooppejs ksotooppeja ixotooppeja isltooppeja isogooppeja isotloppeja isotolppeja isotooöpeja isotoopöeja isotooppdja isotooppema isotooppejz sotooppeja istppeja istooppeja isotooppja isotooppej stppj; 13754446537552; Alkuaineiden isotooppeja; document
alkuaineiden jaksollinen järjestelmä aalkuaineiden alkuaineidenn alkuaineiden slkuaineiden aökuaineiden alluaineiden alkiaineiden alkusineiden alkuaoneiden alkuaimeiden alkuainriden alkuaineoden alkuaineifen alkuaineidrn alkuaineidem zlkuaineiden a:kuaineiden aljuaineiden alkjaineiden alkuzineiden alkuakneiden alkuaibeiden alkuaindiden alkuainekden alkuaineicen alkuaineiddn alkuaineideb lkuineiden lkuaineiden alkaineiden alkuineiden alkuaneden alkuaneiden alkuainidn alkuainiden alkuaineden alkuaineidn lkndn jaksolinen jjaksollinen jaksollinenn kaksollinen jsksollinen jalsollinen jakdollinen jakspllinen jaksoölinen jaksolöinen jaksollonen jaksollimen jaksollinrn jaksollinem maksollinen jzksollinen jajsollinen jakxollinen jakslllinen jakso:linen jaksol:inen jaksollknen jaksolliben jaksollindn jaksollineb jksollinen jaksllinen jaksollnen jaksollinn jksllnn jjärjestelmä järjestelmää järjestelmä kärjestelmä j'rjestelmä jätjestelmä järkestelmä järjrstelmä järjedtelmä järjesyelmä järjestrlmä järjesteömä järjestelnä järjestelm' märjestelmä jörjestelmä jäfjestelmä järmestelmä järjdstelmä järjextelmä järjesgelmä järjestdlmä järjeste:mä järjestelkä järjestelmö jrjestelm jrjestelmä järjstlmä järjstelmä järjestlmä jrjstlm; 13754489187329; Alkuaineiden jaksollinen järjestelmä; document
